content,headline,time,cleaned_content,topic,probability
"Boeing’s profits more than halved in the last three months as the company struggled to recover from two fatal crashes of its top-selling 737 Max aircraft and current trade disputes took their toll.The company, which still expects the troubled 737 Max jet to return to service by the end of the year, also said it plans to cut production of its wide-bodied 787 Dreamliner, a move that reflects the effect of global trade tensions.The company said slowed production of the Max will cost an additional $900m on top of $2.7bn loss of income already anticipated. Overall revenue for the quarter dropped 20% – less than investors feared. Boeing shares, which have dropped 20% since the Max was grounded in March, rose 3%.The drop in profits comes as Boeing announced that Kevin McAllister, head of its commercial jetliner division, is leaving the company after just three years at the job.McAllister’s exit comes less than two weeks after chief executive Dennis Muilenburg, who is scheduled to testify before Congress next week, was stripped of the company’s chairmanship.Muilenburg’s demotion followed a further hit to Boeing’s reputation for safety last week when published messages between two test pilots showed that Boeing knew about problems with the 737 Max’s MCAS anti-stall system three years before the crashes in Indonesia and Ethiopia, killing 189 and 157 respectively.The exchanges contradict Boeing’s previous position that it had no idea the system was unsafe. In the messages from 2016, simulator pilot Mark Forkner complained MCAS was acting unpredictably. “It’s running rampant,” he said.Separately, aviation authorities in Indonesia have briefed family members on their findings about the crash of Lion Air flight 610 before the release of the final accident report on Friday.Investigators from the Indonesian National Transportation Safety Committee in Jakarta said systemic design flaws in the 737 Max were compounded by errors by the plane’s pilots, who had not been sufficiently instructed on how to handle MCAS malfunctions.",Boeing profits fall by more than half as 737 Max scandal swirls,2019-10-23/17:39:26,boeing s profits more than halved in the last three months as the company struggled to recover from two fatal crashes of its top selling  max aircraft and current trade disputes took their toll the company which still expects the troubled  max jet to return to service by the end of the year also said it plans to cut production of its wide bodied  dreamliner a move that reflects the effect of global trade tensions the company said slowed production of the max will cost an additional m on top of  bn loss of income already anticipated overall revenue for the quarter dropped  less than investors feared boeing shares which have dropped  since the max was grounded in march rose  the drop in profits comes as boeing announced that kevin mcallister head of its commercial jetliner division is leaving the company after just three years at the job mcallister s exit comes less than two weeks after chief executive dennis muilenburg who is scheduled to testify before congress next week was stripped of the company s chairmanship muilenburg s demotion followed a further hit to boeing s reputation for safety last week when published messages between two test pilots showed that boeing knew about problems with the  max s mcas anti stall system three years before the crashes in indonesia and ethiopia killing  and  respectively the exchanges contradict boeing s previous position that it had no idea the system was unsafe in the messages from  simulator pilot mark forkner complained mcas was acting unpredictably it s running rampant he said separately aviation authorities in indonesia have briefed family members on their findings about the crash of lion air flight  before the release of the final accident report on friday investigators from the indonesian national transportation safety committee in jakarta said systemic design flaws in the  max were compounded by errors by the plane s pilots who had not been sufficiently instructed on how to handle mcas malfunctions ,Boeing Crisis,0.40474394
"European air safety regulators have told their US counterpart they want more testing on fixes to the troubled 737 Max flight-control systems before the plane is cleared to re-enter service.According to the Wall Street Journal, the EU’s Aviation Safety Agency (EASA) told the Federal Aviation Authority (FAA) it was not satisfied with demonstrations of the reconfigured safety systems on the planes, which were involved in two crashes in Indonesia and Ethiopia that killed 346 people.Boeing had initially scheduled the plane to re-enter service at the end of August but disagreements over software details, centered on how the plane’s dual flight-control computers are now intended to start working together, have put that date back to at least the end of November.The aim, according to the Journal, is to add redundancy by having both computers work simultaneously to eliminate potential problems stemming from computer chip malfunctions.The issue is separate from changes to the aircraft’s faulty Maneuvering Characteristics Augmentation System (MCAS) but related to an emergency procedure that can be used by pilots to address the plane’s system malfunctions.Over the past months, Boeing and regulators have agreed on software revisions to MCAS designed to scale back the power, and reduce the likelihood of the system kicking in and forcing the plane’s nose down.Last week Boeing’s CEO, Dennis Muilenburg, said test pilots had completed more than 700 Max flights.“We are very confident in that software solution, and we are now just marching through the final steps on certifying that, so that everybody’s confident in the safety of the airplane,” he said at a public appearance in New York.The new issue was identified during tests in June when a test pilot found that the procedure took more time than was acceptable to execute.A spokesman for the aircraft maker said: “We continue to work with regulators on addressing their concerns and working through the process for certifying the 737 Max software and training updates and safely returning the airplane to service.”The latest problems for Boeing come as pilots for Southwest Airlines, one of the largest operators of the troubled jet, sued the company, claiming the grounding of the 737 Max jets with the loss of 30,000 scheduled flights has cost them more than $100m in pay.In court papers, Southwest’s pilots association accusing Boeing of lying when it said the planes were just as safe as their predecessors.“Our pilots should not be expected to take a significant and ever-expanding financial loss as a result of Boeing’s negligence,” Jon Weaks, the union’s president, said in a statement. In total, 387 737 Max flown by 60 airlines are grounded.Boeing’s stock has dropped 11% since the 737 Max was grounded in March, costing the company $27bn in market capitalization. Before the crashes, the plane accounted for nearly 70% of Boeing’s overall commercial aircraft deliveries, and 30% of its total operating profit.",Boeing 737 Max: European regulators insist on more testing of troubled plane,2019-10-08/16:19:52,european air safety regulators have told their us counterpart they want more testing on fixes to the troubled  max flight control systems before the plane is cleared to re enter service according to the wall street journal the eu s aviation safety agency easa told the federal aviation authority faa it was not satisfied with demonstrations of the reconfigured safety systems on the planes which were involved in two crashes in indonesia and ethiopia that killed  people boeing had initially scheduled the plane to re enter service at the end of august but disagreements over software details centered on how the plane s dual flight control computers are now intended to start working together have put that date back to at least the end of november the aim according to the journal is to add redundancy by having both computers work simultaneously to eliminate potential problems stemming from computer chip malfunctions the issue is separate from changes to the aircraft s faulty maneuvering characteristics augmentation system mcas but related to an emergency procedure that can be used by pilots to address the plane s system malfunctions over the past months boeing and regulators have agreed on software revisions to mcas designed to scale back the power and reduce the likelihood of the system kicking in and forcing the plane s nose down last week boeing s ceo dennis muilenburg said test pilots had completed more than  max flights we are very confident in that software solution and we are now just marching through the final steps on certifying that so that everybody s confident in the safety of the airplane he said at a public appearance in new york the new issue was identified during tests in june when a test pilot found that the procedure took more time than was acceptable to execute a spokesman for the aircraft maker said we continue to work with regulators on addressing their concerns and working through the process for certifying the  max software and training updates and safely returning the airplane to service the latest problems for boeing come as pilots for southwest airlines one of the largest operators of the troubled jet sued the company claiming the grounding of the  max jets with the loss of   scheduled flights has cost them more than m in pay in court papers southwest s pilots association accusing boeing of lying when it said the planes were just as safe as their predecessors our pilots should not be expected to take a significant and ever expanding financial loss as a result of boeing s negligence jon weaks the union s president said in a statement in total   max flown by  airlines are grounded boeing s stock has dropped  since the  max was grounded in march costing the company bn in market capitalization before the crashes the plane accounted for nearly  of boeing s overall commercial aircraft deliveries and  of its total operating profit ,Boeing Crisis,0.583218694
"The US is set to impose $7.5bn (£6.1bn) of tariffs on exports from the EU including scotch whisky, French wine and cheese and aircraft in retaliation for subsidies given to the aerospace group Airbus after a World Trade Organization (WTO) ruling.The tariffs announced on Wednesday could come into effect as early as 18 October and represent a significant widening of the Trump administration’s trade dispute with the EU, adding to growing tensions in the world economy.The US trade representative’s office (USTRO) released a list of hundreds of European agricultural products that will be subject to a 25% tariff, including British woollen jumpers and pullovers. Cookies, salami, butter and yogurt from some countries will be affected, along with olives from France, Germany and Spain, EU-produced pork sausage and other pork products other than ham, and German coffee.The USTRO said it would “continually re-evaluate these tariffs based on our discussions with the EU” and expects to enter talks in a bid to resolve the dispute.Still some Italian foods – Parmesan, Reggiano, Romano and provolone cheese – were hit with tariffs as were Italian fruits, clams and yogurt. Also seeing new tariffs are German and British camera parts, industrial microwave ovens, printed books, sweet biscuits and waffles.The US has also imposed a 10% levy on EU-made airplanes that could hurt US airlines that have ordered billions of dollars of Airbus aircraft.Food importers in the US were dismayed by the move and said the levies would hurt the upcoming crucial Christmas sales period.“It looks pretty bad. They hit cheese hard,” said Ralph Hoffman, a vice president of the Cheese Importers Association of America.It comes as the global economy is already struggling with the effects of a trade war against China launched by the Trump administration. Stock markets worldwide sold off on Wednesday amid signs of an economic slowdown and worsening trade relations.The EU said on Wednesday it would retaliate if the US imposed tariffs. Cecilia Malmström, the EU commissioner for trade, issued a statement saying the EU had shared proposals on settling the dispute in July. She said: “Our readiness to find a fair settlement remains unchanged. But if the US decides to impose WTO-authorised countermeasures, it will be pushing the EU into a situation where we will have no other option than to do the same.”The WTO ruling is the latest blow in a 15-year battle between the European manufacturer and its US rival, Boeing over state aid given to the companies. Next year, the WTO is preparing to rule on what tariffs the EU can impose in retaliation to US state aid given to Boeing.The case, first brought in 2004, involved aid given to Airbus by EU nations for the development of its A380 superjumbo jet and the smaller A350. The US alleged that Airbus illegally received loans on preferential terms and billions of euros in grants. The WTO, which is tasked with settling trade disputes, gave a mixed verdict in 2010, which was followed by years of appeals.Boeing issued a statement blaming Airbus’s non-compliance with WTO rulings as the reason for the possible tariffs.A spokesman said: “Unfortunately, Airbus’s non-compliance will negatively impact European member states, industries, and businesses completely unrelated to Airbus’s actions, as well as Airbus’s airline customers. Yet even today, Airbus could still completely avoid these tariffs by coming into full compliance with its obligations. We hope it will finally do that.”Airbus said the imposition of tariffs would create insecurity and disruption to the aerospace industry and the broader global economy. The company called for a negotiated settlement.Guillaume Faury, Airbus’s chief executive, said: “Airbus will continue working with its US partners, customers and suppliers, to address all potential consequences of such tariffs that would be a barrier against free trade and would have a negative impact on not only the US airlines but also US jobs, suppliers, and air travellers.“Airbus is therefore hopeful that the US and the EU will agree to find a negotiated solution before creating serious damage to the aviation industry as well as to trade relations and the global economy.”Airbus and Boeing vie every year for the top position in the aircraft manufacturing and sales leagues. Boeing last year delivered 806 planes to customers, six more than Airbus.Boeing has endured one of the most difficult years in its history, after two crashes involving its 737 Max jet that killed 346 people following the apparent malfunction of safety features.",Scotch whisky and French wine hit by $7.5bn US tariffs,2019-10-03/00:30:05,the us is set to impose  bn  bn of tariffs on exports from the eu including scotch whisky french wine and cheese and aircraft in retaliation for subsidies given to the aerospace group airbus after a world trade organization wto ruling the tariffs announced on wednesday could come into effect as early as  october and represent a significant widening of the trump administration s trade dispute with the eu adding to growing tensions in the world economy the us trade representative s office ustro released a list of hundreds of european agricultural products that will be subject to a  tariff including british woollen jumpers and pullovers cookies salami butter and yogurt from some countries will be affected along with olives from france germany and spain eu produced pork sausage and other pork products other than ham and german coffee the ustro said it would continually re evaluate these tariffs based on our discussions with the eu and expects to enter talks in a bid to resolve the dispute still some italian foods parmesan reggiano romano and provolone cheese were hit with tariffs as were italian fruits clams and yogurt also seeing new tariffs are german and british camera parts industrial microwave ovens printed books sweet biscuits and waffles the us has also imposed a  levy on eu made airplanes that could hurt us airlines that have ordered billions of dollars of airbus aircraft food importers in the us were dismayed by the move and said the levies would hurt the upcoming crucial christmas sales period it looks pretty bad they hit cheese hard said ralph hoffman a vice president of the cheese importers association of america it comes as the global economy is already struggling with the effects of a trade war against china launched by the trump administration stock markets worldwide sold off on wednesday amid signs of an economic slowdown and worsening trade relations the eu said on wednesday it would retaliate if the us imposed tariffs cecilia malmström the eu commissioner for trade issued a statement saying the eu had shared proposals on settling the dispute in july she said our readiness to find a fair settlement remains unchanged but if the us decides to impose wto authorised countermeasures it will be pushing the eu into a situation where we will have no other option than to do the same the wto ruling is the latest blow in a  year battle between the european manufacturer and its us rival boeing over state aid given to the companies next year the wto is preparing to rule on what tariffs the eu can impose in retaliation to us state aid given to boeing the case first brought in  involved aid given to airbus by eu nations for the development of its a superjumbo jet and the smaller a the us alleged that airbus illegally received loans on preferential terms and billions of euros in grants the wto which is tasked with settling trade disputes gave a mixed verdict in  which was followed by years of appeals boeing issued a statement blaming airbus s non compliance with wto rulings as the reason for the possible tariffs a spokesman said unfortunately airbus s non compliance will negatively impact european member states industries and businesses completely unrelated to airbus s actions as well as airbus s airline customers yet even today airbus could still completely avoid these tariffs by coming into full compliance with its obligations we hope it will finally do that airbus said the imposition of tariffs would create insecurity and disruption to the aerospace industry and the broader global economy the company called for a negotiated settlement guillaume faury airbus s chief executive said airbus will continue working with its us partners customers and suppliers to address all potential consequences of such tariffs that would be a barrier against free trade and would have a negative impact on not only the us airlines but also us jobs suppliers and air travellers airbus is therefore hopeful that the us and the eu will agree to find a negotiated solution before creating serious damage to the aviation industry as well as to trade relations and the global economy airbus and boeing vie every year for the top position in the aircraft manufacturing and sales leagues boeing last year delivered  planes to customers six more than airbus boeing has endured one of the most difficult years in its history after two crashes involving its  max jet that killed  people following the apparent malfunction of safety features ,Boeing Crisis,0.160817042
"Ryanair has written to UK pilots asking them to take unpaid leave or transfer to other bases abroad, saying they could otherwise join the 9,000 job losses at Thomas Cook.The airline, which reported profits of €1bn (£886m) in May, told its pilots that a “significant surplus of pilots must be reduced” at UK bases including Stansted and Manchester, and that it was encouraging them to take up to 12 months of unpaid leave.It said that there were limited vacancies for full-time pilots at bases in Morocco, Romania and Hungary.The memo, sent on Tuesday, said: “With yesterday’s collapse of Thomas Cook with the loss of 9,000 jobs in the UK and potentially a further 13,000 jobs across Europe, we hope that there will be sufficient applications for unpaid leave/part time, so we do not have to resort to job losses at [your base] this winter.”It blamed the delay to Boeing 737 Max deliveries for the decision. Ryanair had ordered up to 135 of the aircraft for its expansion plans, with the first planes due this year. The model remains grounded, however, since the Ethiopian Airlines and Lion Air crashes.The memo came a week after UK pilots called off the remainder of a series of strikes this month. The pilots union, Balpa, had complained about Ryanair’s “abysmal approach to industrial relations” and said the dispute over pay and conditions was driven by resentment over a range of cost-saving measures used by Ryanair.Ryanair had called the strikes pointless and managed to operate the majority of its UK schedules by bringing in more contractors and pilots from overseas bases. The airline had warned of winter base closures across Europe.Last week, the chief executive, Michael O’Leary, was awarded a new pay package in which he could receive a €99m (£88m) bonus within five years, although almost half of Ryanair shareholders voted against it.",Ryanair urge UK pilots to transfer overseas or face job losses,2019-09-25/19:22:41,ryanair has written to uk pilots asking them to take unpaid leave or transfer to other bases abroad saying they could otherwise join the   job losses at thomas cook the airline which reported profits of bn m in may told its pilots that a significant surplus of pilots must be reduced at uk bases including stansted and manchester and that it was encouraging them to take up to  months of unpaid leave it said that there were limited vacancies for full time pilots at bases in morocco romania and hungary the memo sent on tuesday said with yesterday s collapse of thomas cook with the loss of   jobs in the uk and potentially a further   jobs across europe we hope that there will be sufficient applications for unpaid leave part time so we do not have to resort to job losses at your base this winter it blamed the delay to boeing  max deliveries for the decision ryanair had ordered up to  of the aircraft for its expansion plans with the first planes due this year the model remains grounded however since the ethiopian airlines and lion air crashes the memo came a week after uk pilots called off the remainder of a series of strikes this month the pilots union balpa had complained about ryanair s abysmal approach to industrial relations and said the dispute over pay and conditions was driven by resentment over a range of cost saving measures used by ryanair ryanair had called the strikes pointless and managed to operate the majority of its uk schedules by bringing in more contractors and pilots from overseas bases the airline had warned of winter base closures across europe last week the chief executive michael o leary was awarded a new pay package in which he could receive a m m bonus within five years although almost half of ryanair shareholders voted against it ,Boeing Crisis,0.28082481
