headline,standfirst,author,date_time,content
"Ocean acidification can cause mass extinctions, fossils reveal","Carbon emissions make sea more acidic, which wiped out 75% of marine species 66m years ago",Damian Carrington,2019-10-21T20:00:36+0100,"Ocean acidification can cause the mass extinction of marine life, fossil evidence from 66m years ago has revealed.A key impact of today’s climate crisis is that seas are again getting more acidic, as they absorb carbon emissions from the burning of coal, oil and gas. Scientists said the latest research is a warning that humanity is risking potential “ecological collapse” in the oceans, which produce half the oxygen we breathe.The researchers analysed small seashells in sediment laid down shortly after a giant meteorite hit the Earth, wiping out the dinosaurs and three-quarters of marine species. Chemical analysis of the shells showed a sharp drop in the pH of the ocean in the century to the millennium after the strike.This spike demonstrated it was the meteorite impact that made the ocean more acidic, effectively dissolving the chalky shells of many species. Large-scale volcanic activity was also considered a possible culprit, but this occurred over a much longer period.The oceans acidified because the meteorite impact vaporised rocks containing sulphates and carbonates, causing sulphuric acid and carbonic acid to rain down. The mass die-off of plants on land after the strike also increased CO2 in the atmosphere.“We show ocean acidification can precipitate ecological collapse,” said Michael Henehan at the GFZ German research centre for geosciences in Potsdam, who led the study. “Before we had the idea, but we did not have the empirical proof.”The researchers found that the pH dropped by 0.25 pH units in the 100-1,000 years after the strike. It is possible that there was an even bigger drop in pH in the decade or two after the strike and the scientists are examining other sediments in even finer detail.Henehan said: “If 0.25 was enough to precipitate a mass extinction, we should be worried.” Researchers estimate that the pH of the ocean will drop by 0.4 pH units by the end of this century if carbon emissions are not stopped, or by 0.15 units if global temperature rise is limited to 2C.Henehan said: “We may think of [acidification] as something to worry about for our grandchildren. But if it truly does get to the same acidification as at the [meteorite strike] boundary, then you are talking about effects that will last for the lifetime of our species. It was hundreds of thousands of years before carbon cycling returned to normal.”The research, published in the journal Proceedings of the National Academy of Sciences, analysed sediments that Henehan encountered by chance, during a conference field trip in the Netherlands. The sediments, which straddle the moment of the impact, lie in caves that were used by people hiding from the Nazis during the second world war. “It was so lucky,” said Henehan.The rocks contained foraminifera, small-shelled marine organisms. “In the boundary clay, we managed to capture them just limping on past the asteroid impact. But you can see their shell walls were much thinner and poorly calcified after the impact,” he said.It was the knock-on effects of acidification and other stresses, such as the “nuclear winter” that followed the impact, that finally drove these foraminifera to extinction, he said: “You have the complete breakdown of the whole food chain.” He said oceans also faced additional stresses today, from global heating to widespread pollution, overfishing and invasive alien species.Phil Williamson, at the University of East Anglia, who was not involved in the research, said: “It is relatively easy to identify mass extinction events in the fossil record, but much harder to know exactly what caused them. Evidence for the role of ocean acidification has generally been weak, until now.”He said caution was needed in making the comparison between the acidification spike 66m years ago and today: “When the asteroid struck, atmospheric CO2 was naturally already much higher than today, and the pH much lower. Furthermore, large asteroid impacts cause prolonged darkness.”Williamson added: “Nevertheless, this study provides further warning that the global changes in ocean chemistry that we are currently driving have the potential to cause highly undesirable and effectively irreversible damage to ocean biology.”Henehan said the generally lower ocean pH 66m years ago might have made shelled organisms more resilient to acidification. “Who knows if our current [marine] system is as well set up to cope with sudden acidification?”"
'Racism dictates who gets dumped on': how environmental injustice divides the world,"Five luminaries explain the concept of ‘environmental justice’ and reveal why, alongside the climate crisis, it is one of the most pressing issues of our time ",Nina Lakhani,2019-10-21T11:00:25+0100,"Today the Guardian is launching a year-long series, Our Unequal Earth, investigating environmental injustices: how ecological hazards and climate disasters have the harshest impacts on people of color, native tribes and those on low incomes.The most egregious examples include the lead poisoning crisis in Flint, Michigan, petrochemical pollution in Louisiana’s Cancer Alley, and today’s series launch story, about an entire river that stops at the US-Mexico border, leaving ordinary Mexicans without water. Each of these cases has also prompted inspiring community activism.Our new environmental justice reporter, Nina Lakhani, asked five luminaries of the movement to explain “environmental justice” in their own words. They reveal why, alongside global heating and the extinction crisis, it is one of the most pressing issues of our time.Q: How did the environmental justice movement begin?I started working on environment and race in 1978/79 by collecting landfill data for a landmark civil rights lawsuit filed by my wife in Houston, Texas, against the city and the state. This study found that between the 1930s and 1978, 82% of all the waste in Houston was dumped in black neighborhoods, even though only 25% of the population was black. This was not random or isolated; it was targeted and widespread across the southern states and the nation. We lost in court but the concept of environmental racism was born.The seminal Environmental Justice principles adopted by the National People of Color Environmental Leadership Summit in 1991 built on this [legal case] and became the foundation for social justice movements across the world. Even so, the same discrimination and racism continues to dictate who gets dumped on and who gets resources to mitigate floods, wildfires and other disasters. Of course those with wealth and political clout do best; if you have money you can buy bottled water or move house. The poor cannot go anywhere. Q: How are native communities affected by environmental discrimination?We cannot talk about environmental injustice without understanding the historical context of colonization and capitalism. The federal government put us on reservations on land they believed to be worthless, but many turned out to be rich in “resources”. This means we’re in the way of profits. In most cases we don’t want these megaprojects coming in and destroying our land and water, but it happens anyway. The situation is even worse for our brothers and sisters in the global south where people are silenced, disappeared and killed to make money with no hope of justice. I grew up in a community full of environmental injustices without knowing it. So many people I knew – young and old, men and women – got cancer, including me during my second year in college. I thought this was normal. Our territory is contaminated by the coal industry, uranium mining, over-fertilization and oil. But environmental injustice is a tangled web, it’s about so much more than pollution. Whenever there’s a new megaproject, the area is overwhelmed by men, there’s an influx of money and a rise in organized crime. After the oil boom in 2007, the number of missing and murdered indigenous women increased, and so did drugs. Gangs came and recruited our young people to sell drugs and many of these young men are now in jail or dead. Q: What role does the state play in creating environmental inequalities?Environmental injustice is about [the state] creating sacrifice zones where we place everything which no one else wants. The justification is always an economic one, that it makes sense to build chemical plants on so-called cheap lands where poor people and people of color live, but which are only cheap because all the wealth and economic opportunities have been stripped out. The people who live in these areas are unseen, unheard and undervalued. Environmental justice is about communities being able to reclaim their power, like Spartanburg in South Carolina, which received a $20,000 EPA environmental justice grant [to help clean up contaminated industrial sites], which it leveraged to almost $300m [from public and private sources, to build housing, a job training facility and health centers on the rehabilitated lands].It took a long, long time to build trust with communities, create statutes and programs, which are now being dismantled. The cuts to the EPA proposed by the Trump administration are about protecting the industries which supported Trump’s campaign, and power and discrimination. It’s about showing communities of color and poor communities the administration can do whatever it wants to them because their lives don’t matter.Q: The fight for ‘climate justice’ has become central to the environmental justice movement. Why are you and so many young people getting involved? Climate justice has mobilized young people because there’s something in it for everyone. Whether you care about animals, science, pollution, racism or sexism, all these issues are intertwined with the climate crisis in the worst possible way. Poor people and people of color are much more likely to die in climate disasters than rich people. This means addressing racism, colonialism and patriarchy, because inequalities do not exist in a vacuum, and neither does the climate crisis. It’s the result of all the other societal evils.For me, the climate crisis has been looming over my entire life – and future. Three things happened in 2017 which motivated me to act: the US leaving the Paris agreement, Hurricane Maria destroying Puerto Rico and the wildfires in Canada, which created a thick layer of smog over Seattle that felt apocalyptic. At the beginning my dream with the #ThisIsZeroHour campaign was to mobilize a lot of people for a youth climate march, but it’s got bigger and bigger and we now have a hundred chapters. So far it has been very US-focused but that’s changing. Q: What did we learn from the Flint scandal, in which 100,000 residents were exposed to excessive lead from their tap water?The Flint scandal showed the American people and the world that access to clean water in the US is not always a given. It showed that we have testing methods that are flawed, and we need them fixed, and that sometimes the people who are paid to protect us don’t always do what is in our best interests. It has become my personal mission to make sure we get the Lead and Copper Rule [a federal regulation which limits the concentration of these heavy metals in public drinking water] changed so it protects people like it’s supposed to. I want everyone to know that as of today the EPA has not kept its promises to fix the laws, and still allows states to cheat on water testing.Q: How can people get involved in the struggle for environmental justice?I was an ordinary citizen compelled to take action after watching my children break out in rashes, scream in agony from taking a bath, unexplained illnesses, losing their hair and being told the problem was specific to my house even though the same things were happening to children all over Flint.I made the decision to teach myself about how water is treated, about federal laws and about how to properly test water, because listening to governmental officials lie to my face disgusted me. When situations like this happen, everyday people need to protect themselves. They need to follow their gut if they feel something is wrong. They need to unite because together we are stronger.Sit down in your groups and communities and figure out people’s strengths. You will have defeats – use those as learning experiences. You will have victories, rejoice when those happen. Our environment plays a huge role in our health and future generations’ health, so it is our duty as ordinary people to protect it and fight back. We can make a difference.To contact Nina Lakhani, the Guardian’s new environmental justice reporter, e-mail nina.lakhani@theguardian.com."
Fowl language: Amazonian bird's mating call noisiest in world,White bellbird’s call reaches same volume as pneumatic drill during courtship ritual,Daniel Grossman,2019-10-21T16:20:16+0100,"A bird in the Amazon has shattered the record for the loudest call to be recorded, reaching the same volume as a pneumatic drill.The white bellbird, which lives in the mountains of the north-eastern Amazon, was recorded at 125 decibels (dB), three times louder than the next bird in the pecking order, the screaming piha.Mario Cohn-Haft, an ornithologist at the National Institute of Amazonian Research and the author of a paper published in the journal Current Biology, captured a male white bellbird specimen in the Brazilian state of Roraima in 2017.It was about 30cm (12in) long from beak to tail, said Cohn-Haft. He dissected it in the field, removing the skin and some organs to prepare it to be added to his collection. Something caught his eye under the bird’s pure white feathers: a muscular, sculpted chest. “It had a six pack,” he said, with tissue five times thicker than that of most birds its size.Cohn-Haft enlisted the help of Jeff Podos, an animal behaviour specialist at the University of Massachusetts and a co-author of the paper, to study the white bellbird. They suspected that the bird’s muscular physique might explain its earsplitting song: the male sings an explosive two-toned cry.Cohn-Haft and Podos returned to Roraima and crept up to within 40 metres (130ft) of white bellbirds singing from bare branches. They had brought a directional microphone and a precision audio recorder. In order to make accurate measurements, they had to make recordings with the birds facing them, with no intervening obstacles.The scientists also had front row seats to watch the birds’ bizarre courtship rituals. The female alights on a branch about a metre from the male, which promptly begins singing the louder of the two songs in its repertoire. Cohn-Haft said the male faces directly away from the potential mate for the first of the song’s notes. Then, in a fraction of a second, he swivels around and yells the second note “right in her face”.“She knows it’s coming,” said Cohn-Haft, because just before the second note she flutters back a few metres. The male has a long black wattle hanging down from the top of his head that whips around when he turns his head. “If she didn’t know any better she’d get it in the face,” he said.The bird’s song was recorded at 125dB, which Cohn-Haft and Podos say raises many questions. For starters, said Podos, “how can they do this without going deaf?” The researchers suggested the unusual call may be the result of sexual selection. Cohn-Haft speculated that plentiful food in the bellbird’s mountain habitat had allowed the species to become unhitched from strict obedience to the dictates of survival of the fittest.“Survival is easy enough, so these birds are free to develop traits that, whimsically or not, are attractive to each other.” He said these traits had more in common with the “beauty” of a song or a dance than utilitarian behaviours such as hunting or tools for fighting such as teeth and claws.“This is an example of sexual selection gone wild,” said Podos.He said there was no particular scientific benefit to identifying the most deafening birdsong, any more than there was to identifying the cheetah as the animal kingdom’s swiftest runner. But he said scientists garnered important insights from nature’s extremes. “It’s a good place to understand the limits of what nature can offer,” he said."
Renewable energy to expand by 50% in next five years - report,Energy agency says solar power will drive faster than forecast growth in renewables,Jillian Ambrose,2019-10-21T06:00:23+0100,"Global supplies of renewable electricity are growing faster than expected and could expand by 50% in the next five years, powered by a resurgence in solar energy.The International Energy Agency (IEA) found that solar, wind and hydropower projects are rolling out at their fastest rate in four years.Its latest report predicts that by 2024 a new dawn for cheap solar power could see the world’s solar capacity grow by 600GW, almost double the installed total electricity capacity of Japan. Overall, renewable electricity is expected to grow by 1,200GW in the next five years, the equivalent of the total electricity capacity of the US.“This is a pivotal time for renewable energy,” said the IEA’s executive director, Fatih Birol. “Technologies such as solar photovoltaics (PV) and wind are at the heart of transformations taking place across the global energy system. Their increasing deployment is crucial for efforts to tackle greenhouse gas emissions, reduce air pollution, and expand energy access.”The Guardian reported earlier this month that a renewable energy revolution could end the world’s rising demand for oil and coal in the 2020s, decades ahead of forecasts from oil and mining companies.Renewable energy sources make up 26% of the world’s electricity today, but according to the IEA its share is expected to reach 30% by 2024. The resurgence follows a global slowdown last year, due to falling technology costs and rising environmental concerns.However, Birol warned that the role of renewables in the global energy system would need to grow even faster if the world hopes to meet its climate targets.The report said growing climate ambitions in the European Union and the US played the biggest role in driving the IEA’s forecasts higher, but it will be China which leads the way in rolling out wind and solar energy projects.The IEA expects solar energy to play the biggest role in jumpstarting fresh growth in global renewable energy because falling costs are already below retail electricity prices in most countries.The cost of solar power is expected to decline by a further 15% to 35% by 2024, spurring further growth over the second half of the decade.The appetite of energy-hungry businesses and factories is expected to be the biggest driver of the solar power boom as company bosses exploit falling costs to help cut their energy bills.But the number of home solar panels is also expected to more than double to reach around 100m rooftops by 2024, with the strongest per capita growth in Australia, Belgium, California, the Netherlands and Austria.Even after the “spectacular” growth expected for solar over the next five years, panels will cover only 6% of the world’s available rooftops, leaving room for further growth.“Renewables are already the world’s second largest source of electricity, but their deployment still needs to accelerate if we are to achieve long-term climate, air quality and energy access goals,” Birol said.He warned that although the potential for solar power was “breathtaking” the rapid rollout could disrupt electricity markets unless regulators and utilities adapt."
"Scores more heart attacks and strokes on high pollution days, figures show",Data reveals acute impact on people’s health and the strain it puts on emergency services,Fiona Harvey,2019-10-21T00:01:09+0100,"Scores of children and adults are being rushed to hospital for emergency treatment on days of high pollution in cities across England, figures show.Each year emergency services see more than 120 additional cardiac arrests, more than 230 additional strokes and nearly 200 more people with asthma requiring hospital treatment on days of high pollution compared with the average on days of lower pollution.The data, to be published in full next month, shows the extra strain that poor air quality is putting on already stretched NHS emergency resources.Simon Stevens, the chief executive of NHS England, said: “These new figures show air pollution is now causing thousands of strokes, cardiac arrests and asthma attacks, so it’s clear that the climate emergency is in fact also a health emergency. Since these avoidable deaths are happening now, not in 2025 or 2050, together we need to act now.”Previous studies have found spikes in hospital admissions and GP visits on days of high pollution, but the new data gives precise numbers for nine English cities and shows a clear relationship between heart attacks, strokes and respiratory illnesses and dirty air.The researchers defined high pollution days by dividing the year in two based on levels of pollution and comparing the number of cases of the relevant illness in the higher pollution half of the year with the number of similar cases on each day in the lower half.The data, collated by King’s College London (KCL), covers London, where there are 338 more emergencies a year on higher pollution days compared with low pollution days, Birmingham (65 a year), Bristol (22), Derby (16), Liverpool (28), Manchester (34), Nottingham (19), Oxford (10) and Southampton (16).Much of the recent research on air pollution has focused on the lifelong effects of chronic exposure, including cognitive decline, stunted growth in children and premature death. However, it can also bring on serious illness more immediately.Jenny Bates, an air pollution campaigner at Friends of the Earth, said: “Many people may not realise how dangerous air pollution at high levels can be, and that it can trigger heart attacks, strokes and asthma attacks as well as having long-term health effects. These figures will be a wake-up call for city leaders to take the strongest possible action.”The government has pledged to tackle air pollution in its environment bill, proposals for which were laid out after the Queen’s speech. Campaigners are concerned that the measures proposed are too vague and too weak.Polly Billington, the director of UK100, a network of local government leaders across England that have pledged to shift wholly to clean energy by 2050, said: “We would like to see World Health Organization air pollution standards included in the bill, as they are widely seen as gold standard, with a legally binding timetable to meet them, as that creates certainty and enables long-term planning. The absence of significantly increased powers for local leaders, together with a lack of reference to the need for adequate funding, are the big holes in the bill that will hold action back.”On Wednesday the mayor of London, Sadiq Khan, and UK100 will hold an international clean air summit with the World Health Organization (WHO) director general, Tedros Adhanom.Heather Walton, a health expert with the environmental research group at KCL, said the study was intended to provide more detail than others that have tended to concentrate on the effects of air pollution on life expectancy, such as estimates that pollution contributes to 36,000 deaths a year in the UK.By homing in on hospital admissions for cardiac arrests, strokes and asthma, the researchers were able to provide a clearer picture of the acute impacts on people and how emergency services are affected. “This provides additional evidence of the important need for further action to reduce air pollution,” Walton said.Bates said clean air zones were needed, but also measures to cut all traffic “because all vehicles produce deadly fine particle air pollution from brake and tyre wear. This way the air pollution health crisis and the climate emergency can be addressed together, helping to make our cities and towns healthier and more attractive.”The Department for Environment, Food and Rural Affairs said: “We are taking urgent action to improve air quality and tackle pollution so people can live longer healthier lives. Our landmark environment bill will set ambitious, legally binding targets to reduce fine particulate matter and increase local powers to address key sources of air pollution.“We are already working hard to reduce transport emissions and are investing £3.5bn to clean up our air, while our clean air strategy has been praised by the WHO as an example for the rest of the world to follow.”Last week Europe’s environmental watchdog found that little or no progress had been made across Europe on cutting levels of fine particulate matter, known as PM2.5, which is one of the most dangerous forms of pollution because it can lodge deep in the lungs and penetrate the bloodstream."
