headline,standfirst,author,date_time,content
Struggling with The Golden Notebook? The hard work is worth it,"For every moment of high drama, there are also sections of intense tedium. But Doris Lessing’s masterpiece delivers a big payoff",Sam Jordison,2019-10-22T13:08:09+0100,"In my edition of Doris Lessing’s The Golden Notebook, the text that forms the titular volume arrives on page 531. These climactic thoughts, supposedly recorded by the novel’s central character, Anna Wulf, take up only 26 pages. That’s not to say Lessing’s title is a misnomer. The story builds towards these 26 pages and finds a kind of resolution within them.Lessing’s decision to divide her novel into many sections is crucial to the book’s power. She very deliberately split her novel across different aspects of Anna’s personal story and her fractured psychology. The result still seems unique in fiction – it makes for a strange, troubling and difficult reading experience.The black, red, yellow and blue notebooks of the novel are Anna’s different approaches to making sense of herself. In the black one, she reflects on her writing life. In the red, she tracks her political development. Yellow contains her attempts to write (highly autobiographical) fiction, while blue is a diary of her daily life. Meanwhile, the Free Women sections describe Anna in the third person, taking us outside her head in an attempt to record her scattered thoughts.It would be impossible to discuss everything in these sections in a single article. The book features hilarious pastiches about mid-20th-century literary London and bitter satires of film and television producers. There are agonised accounts about the end of the communist dream, and frank commentaries on sex, male impotence and female desire. There are shocking descriptions of the racist politics of white colonialists in Africa. There are insights into both inequality and the privileged bohemian lives of Anna and her friends. (It’s bewildering to read the book in 2019, and encounter all those young artists who have spurned regular employment but live in huge houses in London – that they own!)Sections from each notebook are interspersed throughout the novel, providing numerous cliffhangers and sometimes keeping readers waiting for dozens, even hundreds, of pages before there is a resolution. At the end of the second section, comes one of the biggest shocks I’ve encountered in fiction for a long time. We learn, via a frantic, confusing phone call, that something dreadful has happened. Then we’re cut off, and because of the way the book is set out, if feels only natural that we should have to wait before we get answers. But this just gives Lessing another opportunity to set up more surprises.Alongside this high drama, there are also sections of intense tedium. Even once I was fully invested in the story it could be hard work. Reading the section entitled The Golden Notebook often felt like chewing concrete.But this book is meant to be hard work. There would be something wrong with an entirely enjoyable account of a nervous breakdown. The novel’s longueurs are also partly why it works: Lessing makes us slowly climb this mountain of a story so we can better appreciate the view from the top. Sometimes, I needed to be reminded that there’s a real person writing this story. As we watch Anna writing about her fictional character, Ella, we are reminded of Lessing writing about Anna (and, I suppose, Ella). How much of Lessing’s life feeds into Anna’s, in the same way that Anna’s life feeds into Ella’s’?We can’t know. It seems prurient to demand the exact correspondences between events in Lessing’s life and scenes in her novel. But it would be equally wrong to ignore the importance of the actual world to this fiction. And that isn’t interesting only because of the natural curiosity we have about the author’s life. It is because it raises the stakes, and makes the politics, the madness, the emotion, all more feel more real. Anna’s suffering is not confined only to this novel. It also happens out in the world, to people like Ella, Anna, Lessing – or you and me."
'What are the chances?' Woman reunited with childhood book in museum,Zoe Andrews found her copy of The Secret Garden in Reading’s Museum of English Rural Life,Alison Flood,2019-10-22T11:52:08+0100,"A woman has been reunited with a copy of The Secret Garden she owned as a child, serendipitously discovering it for sale on the shelves of the Museum of English Rural Life shop.The MERL, which made news last year for sending an 18th-century schoolboy’s doodles of a chicken in trousers viral, acquired the Ladybird Children’s Classics edition from a charity shop in Wallingford for its collection of second-hand books. On Friday, it was picked up by its former owner, Zoe Andrews, who looked inside and saw it had her sister’s name in the front cover, written in characters that she’d dreamed up as a child.The MERL’s digital editor Joe Vaughan tweeted about the discovery. “Today, the past sent something back, in our museum, in our strange house of time, like a letter returned to sender,” he wrote. “It’s not every day that you pick up a book, open it, and, in the inside cover, find your sister’s name, in hieroglyphics … the ones you wrote when you were kids.”Andrews “couldn’t believe it when I found this book … Had to repurchase it. What are the chances?!” She couldn’t remember any details about the secret language her and her sister had written on the book. “I had a grid on a sheet of paper with a ‘key’ as to what symbols meant what. This is going back many years, probably 1993/94.”MERL director Kate Arnold-Forster said: “One of the most unexpected yet fascinating aspects of libraries is discovering books that bear traces of their readers’ lives, moving us to speculate about how they were read and enjoyed. That it’s The Secret Garden – a novel that has survived generations and provided a magical escape for so many readers – makes this story all the more wonderful.”The discovery prompted other readers to share on social media stories of unexpectedly discovering their former books. One person wrote that their “father-in-law unpacked a box of books one day and found a hardcover Biggles given to him by auntie Eva – 60 years before, 11th birthday in a totally different part of the country. Awesome roundtrip. His most treasured book now.”Of her Secret Garden find, Andrews said: “When things work their way back to you, they were never meant to leave you in the first place.” She added on Twitter that “it feels right to have the book back”, and after all, it was “only a quid”."
'It's something new': how Mongolian rock band the Hu went viral,"Combining ‘a blend of the east and west’, the Hu have found their way to 45m YouTube views, a smash hit debut album and the admiration of Elton John",Jim Farber,2019-10-22T06:00:54+0100,"The chant started long before the band took the stage.“HU!! HU!! HU!!,” yelled the crowd, at escalating volume, for a full 20 minutes before the Hu kicked off their recent concert at the Brooklyn venue, Warsaw. The fans who packed the place, many of whom were decked out in de rigueur heavy metal gear of black T-shirts and leather, thrust their fists into the air in rhythm to their chants, which grew to a roar the moment the band appeared.The imposing-looking members of the Hu sported leather too, only theirs bore the elaborate patterns and symbols of their homeland, Mongolia. And instead of singing in English, they sang exclusively in their native tongue, delivered in the ancient art of khoomei, or throat singing. In the same vein, their instruments mixed the slashing electric guitars and pounding drums of the west with the richness of the morin khuur (a two-stringed, horse-head fiddle), the tinniness of the tuvshuur (a Mongolian guitar) and the quaver of the tumor khuur (a jaw harp). The beat they kept didn’t so much punch, a la western metal, as gallop, a reference to the horses prized by the nomadic tribes of the band’s ancestors. With so bracing a combination of sights and sounds, the Hu have been forging a highly improbable connection between the complexities of traditional Mongolian music and the 10-ton force of western metal. Think: Genghis Khan ransacking Judas Priest.“Our music is a blend of east and west, old and new,” said Galbadrakh Tsendbaatar, AKA Gala, the band’s lead singer, through a translator. “We’re building on a history and a sound that has been around for thousands of years.”Never before, however, has that sound had the impact in the west it’s currently enjoying, courtesy of the Hu. Their first two videos, for Wolf Totem, and Yuve Yuve Yu (or How Strange, How Strange) have amassed more than 45m views on YouTube over the last year, while their debut album, The Gereg, opened at No 1 on Billboard’s Top New Artist chart and No 2 on the magazine’s Indie Label chart. Likewise, it hit No 2 on the UK’s Rock & Metal Album chart and No 4 on the Album Downloads list, while in Australia it broke the top five in overall digital sales. The Hu’s Facebook page has more than 300,000 followers.Though the band only formed in 2016, their members have been playing their instruments and practicing the tricky rituals of throat singing for most of their lives. The four core members – who also include Enkush (Enkhsaikhan Batjargal), Jaya (Nyamjantsan Galsanjamts) and Temka (Temuulen Naranbaatar) – received formal training at the Mongolian State Music and Dance Conservatory in their country’s capital city, Ulaanbaatar. There, they absorbed a wide variety of music. “Everything from western classical music to jazz to rock and, of course, a lot of traditional Mongolian music,” said Gala.Along the way, the musicians enjoyed a steady diet of metal, via Metallica, System of a Down and Rammstein. Such music from the west had been banned during the communist era of Mongolia, which ended in 1992. Though the band members were just children then, they remember the cultural upheaval well. “We had to go through hardship,” said Jaya. “The country fell into a financial crisis. But it was something we had to do and, because of that change, we are all able to play rock music.”In fact, over the last two and a half decades, a significant contemporary music scene has developed in Ulaanbaatar, fleshed out by lots of local pop groups, (such as boy band Camerton), rock acts (like Altan Urag, whose music was featured in the Netflix series Marco Polo), and hip-hop artists (such as breakout star Mrs M, who will soon record in English). Even so, no one had the notion to translate credible, metallic rock to traditional Mongolian styles before B Dashdondog (AKA Dashka), the producer who formed the Hu. After years of working with local pop and rock groups who simply imitated western sounds, Dashka wanted to forge something fresher. So, he hand-picked the members of the Hu from the Conservatory to fulfill his vision. The band say they didn’t choose their name as a play on the Who’s, but because “hu” is the root word for human being in Mongolian. “We took the name because of the inclusive nature,” Temka said. “It’s not about being Mongolian. It’s about being human.”At the same time, Mongolian themes dominate the band’s lyrics. Many salute their ancestors. “As Mongolians, we are raised to have a great respect for our elders and our history,” said Jaya. “We didn’t come here by ourselves. There are generations of people who paved the way.”Important, too, in the band’s lyrics is a sensitivity to nature. “Human beings and nature are connected,” said Jaya. “And, as nomadic people, we have cattle and we have to move all around so we don’t destroy the land. We respect it.”As Jaya explained, there’s an essential connection between nature and the intent of throat singing. “What we’re trying to do is imitate the sound of the water, and the sound of the wind,” he said. “Nature is right in our voices.”While all the members long ago mastered the art of throat singing, it remains a difficult skill to learn. With khoomei, a single vocalist can produce two, or even three, notes at once by forcing air through a tightened throat. The guttural sound that the technique produces can remind western listeners of the dark cries of thrash singers. “Both put a lot of force on your throat,” said Jaya. “It creates a very energetic sound.”The band’s video for Yuve Yuve Yu likewise stresses the connection between modernity and tradition. It opens with various band members in contemporary settings – an upscale coffee shop in Ulaanbaatar, or at home playing a video game – before Gala opens the door of his urban apartment to enter a vast expanse of mountains and lakes in Mongolia’s remote western region. The images that occupy the rest of the video are so stunning, they could double as a travelogue for the Mongolian tourist board. The band’s second video, for Wolf Totem, unites traditional Mongolian horse riders with leather-clad men on Harleys, suggesting an eastern take on Easy Rider. That connection underscores a bad-ass image that has made the band a natural for metal heads. The smash success of their two videos inspired a rash of labels to woo the band before they even completed their first album. They settled on Eleven Seven Music, home of metal acts from Mötley Crüe to Five Finger Death Punch.“It wasn’t the amount of views of their videos that attracted us,” said Steve Kline, chief operating officer of Eleven Seven. “It was the fact that their sound is completely unique. We couldn’t even put a label on what they do. We just found ourselves saying, ‘we’re not exactly sure what this is. But it’s really good.”The Hu’s debut, which the label released last month, took its name from something the Mongol Empire introduced to the world, the first diplomatic passport, which dates from the 1200s. “People think of the Mongol Empire as just warlords and warriors,” said Jaya. “But there are so many positive things the empire brought to the world, like the first postal system, the first international trading on the Silk Road and the diplomatic pass.”The Hu’s music has become its own passport. Their current American tour has sold out more than half of its dates, and they’ll take their show to Europe at the end of the year and the UK at the start of 2020. For the live dates, they add four auxiliary members to the core foursome, making their sound even more forceful. For another lure, Eleven Seven has begun marketing remixes of their songs featuring cameos from a rash of American rockers, singing in English. The first, for Yuve Yuve Yu, boasts a guest vocal from Danny Case of the rock band From Ashes to New. All the exposure has even helped the Hu attract kudos from some big-name stars. “The other day, Elton John told me he’s a big fan of ours,” Gala said. “He told us it’s been many years since he has heard something this fresh in music.”That’s good news for rock itself, given the fact that the genre is now often considered an old sound that’s past its peak. “We love rock,” Gala insisted. “But people have never heard it sound like this before. That’s why it’s connecting. It’s something new.”"
"Nigel Slater’s roast tomatoes, whipped cheese and samphire recipe",An unusual hot-and-cold take on a piquant herby classic,Nigel Slater,2019-10-22T12:00:59+0100,"Put 1kg of assorted tomatoes into a roasting tin, tuck in 6 sprigs of thyme, season with black pepper and trickle over 5 tbsp of olive oil. Roast at 200C/gas mark 6 for 30 minutes, until the tomatoes are soft and their skins lightly browned in places.Finely chop 2 tbsp of tarragon leaves and the same of basil. Mash 150g of goat’s cheese with a fork and then stir in 100g of crème fraîche. Add the chopped herbs and a little pepper then chill until needed.When the tomatoes are ready, remove them from the oven and transfer to a serving plate. Toss 100g of samphire into the tomato roasting juices in the tin then add next to the tomatoes on the serving plate. Spoon the herbed cheese into a small bowl then serve with pieces of crusty white baguette to soak up the juices. Enough for 2.To get the full sweet, sharp and smoky flavour of the tomatoes, roast them until their skins start to blacken here and there. Serve them hot, straight from the oven to contrast with the chilled whipped cheese.The tomatoes can be replaced by aubergines. Cut them into large cubes, then add to the roasting tin with the thyme and olive oil and bake for a good half hour or so, turning them as they burnish and soften. Season with a sprinkling of za’atar, fresh mint and serve with the whipped cheese and samphire.Follow Nigel on Twitter @NigelSlater"
Bitter-sweet memories: Rachel Roddy's recipe for marmalade cake,Hand-me-down recipes come inseparably steeped in memories – such as this recipe for marmalade cake from an old friend that became etched into the family biography,Rachel Roddy,2019-10-21T12:00:28+0100,"The other day I opened a book to find a sentence, and a bit of paper fell out. As the square piece of block pad glided to the floor like a dead moth, I recognised it as a recipe for a ring cake written out for me not long after coming to Italy, about 14 years ago. I remember making the recipe several times, before using it as a bookmark that was left at page 76. What I don’t remember or recognise is whose neat writing it is.My memory lapse is frustrating. Sharing a recipe is an open-handed act, one made even more tangible if the person sharing has taken the time physically to write it out, maybe with notes, which is a small labour in these copy-and-photograph times.Even if the recipe given is never made, I want to remember where the Post-It lemon pudding or back-of-envelope braised chicken came from. And if the recipe becomes part of my cooking life, it is no different from a recipe from a book or famous chef: it absolutely must have that person attached to it, like a name tag sewn into a collar. Then, every time the recipe is made, the person and your relationship to them, whatever it was, is remembered. Even if it means you have to relive a tired exchange about authenticity, or be reminded that Mario subsequently left his wife for his secretary, recipes have names: Mario’s red-wine risotto; my elegant neighbour Vera’s creme caramel; Lise from Bavaria’s liver and apple.Shared name-tagged recipes are also a way of marking time. Years ago, I organised my mum’s loose recipes, gluing the loose-leaf pages and lips of envelopes into a book and noting where and who they came from. The book is now a sort of collective biography of our family – a strained one.Freda Coleman was a neighbour in the late 1970s, and her marmalade cake marks the margarine years. It was, and is, an ideal cake for a family with congenital marmalade dependency: a rich pound batter into which you stir orange marmalade, which bakes into a bitter-sweet cake. The icing is as good as the cake, which you zig- zag over the top where it then sets into a hard lattice that can be pulled off, although hopefully not from the entire cake as once happened.Part of the pleasure of a cake is the smell as it bakes: marmalade bakes into an almost toffee-like sweetness, and hopefully a bit of peel at the bottom of the cake catches and the smell of that, like dark treacle, assaults your senses.Recipes are only recipes, but they can become fixed points in our lives around which other things move: with them, we can measure time, places, people. Freda’s cake – now our family cake – is one such recipe. If I could only remember the name of the person who gave me the recipe that fell out of the book, that would have a name tag too. Until then, it is just a ring cake. Both cakes are good, but the marmalade triumphs for its amber chunks of peel and icing which, because cake is 50% pleasure, 50% habit, I still want to pull off before eating a slice.This is a cake of four equal parts, plus marmalade (thick-cut or thin, you decide). It is a preference based on habit, but a loaf tin (lined with parchment) seems the best tin for this cake.Prep 10 minCook 40 minMakes 1 loaf110g margarine or butter, at room temp110g sugar2 medium eggs110g self-raising flour4 heaped tbsp marmalade50g icing sugarHot waterBeat together the butter and sugar until soft and creamy. Beat in the eggs, followed by the flour, before stirring in three tablespoons of marmalade.Scape the mixture into a loaf tin lined with parchment. Bake at 170C (150C)/335F/gas 3 for 35 to 40 minutes, or until the top of the cake is puffed up and cracked, and a strand of spaghetti comes out clean.Leave to cool for 30 minutes, then lift the cake from the tin.To make the glaze, loosen the remaining tablespoon of marmalade with a little hot water, then brush the cake.Make a thick icing by mixing the icing sugar with just a little water, and zig-zag it over the cake, letting it dribble down the sides."
A South African shepherd's pie: Thomasina Miers' family recipe for bobotie,"An intriguing recipe handed down by Tommi’s mischievous nanna Mimi – a sort of South African, spicy version of shepherd’s pie called bobotie ",Thomasina Miers,2019-10-21T12:00:25+0100,"My maternal grandmother was known for being a tiddlywinks demon, having the naughtiest twinkle in her eye and, whenever she went home to South Africa, for disappearing into the bush to hang out with Zulu tribespeople – the people with whom she seemed to feel most at home. Her stories of her time there were always captivating, and of the recipes she made that were both homely and exotic, this was one of the best.Don’t be put off by the long list of ingredients – this is essentially a South African shepherd’s pie, only easier, with some lovely spicing thrown in.Prep 15 minCook 1 hr 15 minServes 6-8Butter, for greasing4 tbsp olive oil3 onions, peeled and choppedSalt and black pepper2 garlic cloves, peeled and chopped2 bay leaves1½ tsp mustard seeds2 tsp curry powder½ tsp chilli flakes1 tsp turmeric1 ½ tsp garam masala1kg beef or lamb mince100ml red-wine or cider vinegar100g flaked almonds120g raisins50g fresh breadcrumbs75g fruit chutney (I like Tracklements’ Country Garden Chutney)For the topping3 eggs500ml whole milk3 bay leavesGrease a large baking dish and heat the oven to 180C (160C fan)/gas 4. Warm a large, wide casserole pot over a medium heat and, when hot, add three tablespoons of oil.Add the onion, season with salt and pepper, and sweat for 10 minutes, until soft. Stir in the garlic, bay leaves and spices and cook for another three to four minutes, until fragrant. Scrape the mixture into a bowl and set aside.Return the pan to the heat and add the remaining tablespoon of oil. When hot, season the meat with salt and pepper, and brown in the pan in two or three batches, breaking up the meat with a spoon and cooking until caramelised and dark. Once all the meat is browned, return the onion mixture to the pan and add the vinegar, almonds and raisins.Turn the heat down to low and simmer for five minutes, to allow the flavours to mingle. Take off the heat, stir in the breadcrumbs and chutney and check the seasoning. Transfer to the baking dish, smooth over with the back of a spoon and leave to cool for five to 10 minutes.To make the topping, beat together the eggs and milk and pour over the meat. Scatter over the bay leaves, then bake for 30-35 minutes, until the top is golden and the custard just set. This is delicious served with brown rice and some greens.Leftover flaked almonds make the best biscuits. I love florentines, or you could mix them with honey and a little butter for a crunchy topping for shortbread. Leftover bobotie makes a killer filling for a jacket potato, so don’t eat it all at once."
