headline,standfirst,author,date_time,content
Lowest October rise in UK house prices since 2008 financial crisis,Rightmove says sluggish market and Brexit uncertainty are putting potential sellers off,Rupert Jones,2019-10-21T00:01:10+0100,"UK house prices have registered their lowest October rise since the 2008 financial crisis as Brexit uncertainty continues to take its toll, according to the property website Rightmove.Its data also showed that some parts of London are continuing to see asking prices fall, in some cases by £15,000 or more in a month.The price of property coming to market at this time of year usually experiences an “autumn bounce,” with an average rise of 1.6% recorded in the month of October over the last 10 years – but this year saw a “more sluggish” monthly rise of 0.6%, which was the lowest since October 2008.The current state of the housing market combined with the ongoing political uncertainty from Brexit appears to be putting off many would-be sellers. Rightmove’s average number of new house sale listings per week has fallen to just over 24,000 – its lowest at this time of year since October 2009. This is down 13.5% on the same period a year ago.By contrast, many buyers “seem undeterred”, with the number of sales being agreed virtually unchanged on a year ago, according to the site, whose latest data was based on the asking prices of more than 122,000 properties put on sale between 8 September and 12 October.Miles Shipside, a Rightmove director, said: “With upwards pricing power now pretty flat, some sellers who are motivated by maximising their money seem to be holding back. They may be waiting for more certainty around both achieving their price aspirations, and also the Brexit outcome.”Marc von Grundherr, at the estate agent Benham & Reeves, said that while the sector was more subdued than usual, “the UK property market is yet to disappear down the Brexit abyss”.Rightmove’s detailed data paints a mixed picture for London, with some boroughs seeing sizeable price falls and others experiencing price growth. The average price of a home in Kingston upon Thames, south-west London, has fallen by more than £17,000 in a month – from £605,000 in September to £587,000 in October. Wandsworth in south London recorded a typical £16,000 price fall. But in other boroughs, including Britain’s most expensive area, Kensington and Chelsea, average prices continued to climb."
"Pacer train passengers deserve fare cuts, say northern England leaders",Northern Rail urged to compensate people forced to use outdated ‘buses-on-rails’,Maya Wolfe-Robinson,2019-10-21T10:38:51+0100,"Leading politicians in northern England have demanded a cut in fares on routes that still use the much-derided Pacer trains.In a letter to Northern Rail, they say passengers deserve financial compensation for having to use the “buses-on-rails” that were due to be retired by the end of the year.The Manchester mayor, Andy Burnham, the Sheffield city region mayor, Dan Jarvis, and the Leeds city council leader, Judith Blake, told the train operator that the continued use of the old carriages was “unacceptable” and that an urgent commitment to reduced fares “is the very least that could be done”.The diesel-powered Pacers, built as a temporary stopgap in the 1980s from bus frames set on train wheels, do not comply with disability regulations that come into effect in the new year and still have toilets that flush on to the track. It emerged over the summer that, because of a delay in manufacturing their replacements, they would not be scrapped by 2020 as promised by the rail franchise.The city leaders express “deep disappointment and frustration” in the letter, which was sent to David Brown, the managing director of Arriva Rail North, which owns Northern rail. They also ask for “urgent assurances” regarding the arrangements planned for customers with accessibility requirements while the Pacers remained in use.They say the “widening disparity between transport investment” in northern England, compared with the south has been underlined by the continued use of Pacers, but also acknowledge that withdrawing them before the replacements were ready would be a worse solution. The “retention, for a short, time limited period appears to be the best of an extremely poor range of options”, they write.Blake said the withdrawal of Pacers was “one of the centrepiece commitments made in the Northern franchise”, adding: “The fact they will still be running in 2020 is symbolic of the broader issues with this franchise which continues to deliver an unacceptable level of service to passengers.”The three politicians have requested a meeting to iron out a compensation package and promises regarding accessibility over the next week.Last week, the transport secretary signalled that the Northern rail network could be renationalised after years of late and cancelled trains. Grant Shapps said he had asked the company, which runs routes from Newcastle to Leeds, Liverpool, Hull, Manchester and Stoke, to draw up proposals to improve the service, saying it could not “continue delivering in the current delivery method”. He also said he was “hugely impatient [to see] the extinction of Pacer trains”.A spokesperson for Northern said “a small number of Pacers units” would need to be used “for a short period of time in 2020”. It said the first Pacer went into retirement in August, and “the majority of Pacers” were expected to be removed by the end of the year.The company, acknowledging that “customers will be disappointed”, said it was “finalising proposals for customer support and offers” for passengers who travel on Pacers in 2020.It added: “From today, Monday 21 October, we will have 29 of our 101 new trains in service for customers and a further 27 new trains are in final testing or being used for driver training.“We agree the north deserves the best possible rail service and are working hard to improve performance and reliability for customers.”"
Regulator acts after ‘illegal’ airport parking scheme collapses,"Investors were told paying £20,000 to acquire places at Gatwick and Glasgow would bring returns of 12%",Hilary Osborne,2019-10-20T09:00:50+0100,"Investors who put their money into an airport parking scheme that went into liquidation earlier this year are hoping for compensation after the Financial Conduct Authority announced it was taking legal action against those behind the scheme.The Park First scheme, which collected more than £230m from thousands of people, offered returns of up to 12% to those who invested £20,000 a time on individual parking spaces at Gatwick and Glasgow airports.But the FCA claims it was an “illegal collective investment scheme” that was “promoted to the public using false or misleading statements”.Park First is just the latest in a string of schemes, many related to property, to have disappointed investors who were hoping for decent returns. While it is not always possible to sort the good from the bad, there are some steps you can take to protect yourself.• “As a starting point, never invest in anything that you don’t understand,” says Patrick Connolly of financial advisers Chase de Vere. If something sounds highly complicated, or if the explanation of how the returns will be achieved doesn’t seem to stack up, ask questions. If it still doesn’t make sense, it might be a sign that something is wrong.• It’s an old adage, but true: “If an investment seems too good to be true then it probably is,” says Connolly. “And if it is promoted with a very high interest rate then that means it is very high risk.” With returns on bank accounts still languishing in the low single figures, high rates of return may be a sign of high risk.• “Stick to investing with reputable and established firms,” says James Daley, managing director of consumer group Fairer Finance. The FCA publishes a register of companies that it authorises – you can check it at register.fca.org.uk. It also has a list of unauthorised firms – these are firms that it has received complaints about, but do not assume that a company that does not appear on this list is legitimate.Also look out for the badge of the Financial Services Compensation Scheme – as its name suggests, this is set up to pay out if a company goes wrong and leaves investors out of pocket.• Treat unsolicited calls and emails with suspicion. Often people who have bought into one investment scheme will get calls about others – it may be that some companies sell their lists. There are also fraudsters who make a business out of offering to buy up failed investments – they typically ask for an upfront fee of some kind, then disappear. Do not agree to anything without doing some research first.• Do not assume property is good security. Many schemes offer ownership of a leasehold in return for your cash, and it can be reassuring to know that you own the rights to a room or a piece of land. But as investors caught up in landbanking schemes can vouch, even property can be worthless if you can’t use it and no one else wants to buy it.• Use a reputable financial adviser. “If you’re parting with any serious sums of money, it’s worth taking advice from a good professional,” says Daley. “Look for advisers who are chartered or certified, which means they’re qualified to a higher level.”"
Extinction Rebellion: what price could you pay for taking a stand?,"How being arrested on a climate or anti-Brexit protest could affect your job, mortgage or travel",Miles Brignall,2019-10-19T07:00:24+0100,"For many people, this weekend could be their first experience of protest, whether on the anti-Brexit march on Saturday or as part of Extinction Rebellion’s rolling campaign. But what about those willing to go further and be arrested?Extinction Rebellion launched a wave of civil disobedience on 7 October to highlight the escalating climate emergency, and by yesterday, more than 1,700 people – including the Guardian columnist George Monbiot – had been arrested, with some now facing an anxious wait to find out what comes next.Guardian Money has spent the week looking at the possible financial implications of being arrested in this type of protest, and talked to lawyers, experts and those who have put themselves on the line for environmental causes.We found that, depending on the outcome of arrests, those involved could face issues with their personal finances, including mortgages, insurance and future employment.One of the big unknowns, say those behind the protests, is how many people will be prosecuted. Following previous Extinction Rebellion action, only about 10% of those arrested were charged, but it could well be higher this time. There has been a hardening of attitudes this week at the Home Office and the Metropolitan police, and the Met has warned it will be pushing for more prosecutions this time round.Prosecutions can lead to unspent convictions and – while that might sound technical – it is these that can cause the biggest problems. Extinction Rebellion does not duck this issue on its website, which has downloads and FAQs covering this area. “Before attending an action, it’s crucial that all rebels inform themselves about their rights as protesters and the possible consequences of arrest,” it says.This article is not designed to put anyone off participating in protests. The aim is to clearly spell out the implications that being arrested could have so individuals can make an informed choice.A criminal conviction can be for anything from a serious crime resulting in a prison sentence to littering or speeding leading to a fine. It is likely that in the case of most of those charged this week, it will be for failing to leave a controlled area of London when instructed to do so by a police officer.Once someone has been convicted, that conviction is deemed to be current – or unspent – for a period based on the sentence. The more serious the conviction, the longer it remains unspent.In short, convictions are what insurers, mortgage companies, employers and other organisations do not want to see on your “file”. For example, British Heart Foundation does not accept volunteers to work in its shops if they have any type of unspent conviction.John Briant, an Oxford-based criminal barrister who has been advising local Extinction Rebellion protesters about the implications of being arrested, says most of those previously arrested who chose to go to court have ended up with a conditional discharge of six months and/or a fine related to income. Conditional discharges are only considered to be spent at the end of that term – typically six or nine months.For those who are fined in court, the conviction is only considered to be spent a year from conviction. Those given a community order face a year on top of the order’s length.The extraordinary 15-month prison sentences meted out to anti-fracking protesters are a much bigger problem, as the conviction is not considered spent for a further four years on top of the sentence.It may sound ridiculous, but a 70-year-old retired teacher who may have never claimed on their home insurance is unlikely to have their policy renewed once they reveal they have an unspent conviction.Christopher Stacey, a co-director of the charity Unlock, which was set up 20 years ago to help people with all types of convictions, says most big insurers will not renew, or issue a new household policy, when they learn someone in the insured household has an unspent conviction. Several insurers including Direct Line, LV= and Aviva told Money this was the case.“Getting insurance can be a big problem for people with an unspent conviction. For those with existing house insurance, if you don’t notify them of the change when you next renew, the firm could refuse to pay out if you later try to claim. We have seen this happen in the past, particularly when people have let their policy simply automatically renew,” he says.Convicted protesters given a six-month conditional discharge would be fine if their renewal came up after it was considered spent. However, if it fell within the six months, it would be unlikely to be renewed – if you admit it. Unlock has produced a list of specialist brokers who will help those with an unspent conviction find insurance cover, but this is likely to come at a cost.Some insurers have a clause in their terms and conditions that requires the customer to inform them of a conviction, at any time. One of the UK’s largest, Aviva, told Money it insists customers inform it of any new non-motoring convictions “as soon as reasonably possible”. It admits it could lead to a decline or cancellation of the policy, either at the time or at the point of renewal. As soon as your conviction is spent, you have no obligation to mention it to an insurer. The Unlock calculator can help with this.Car insurers are not so obsessed with non-motoring convictions unless they are serious and relate to theft, fraud or handling stolen goods. Again, you will have to declare any unspent convictions at renewal. However, Aviva said it would insure a driver with a minor protest conviction who had an otherwise clean record – but again at a cost.No, there is no obligation to tell your insurer or other financial company that you were arrested. If you accept a caution, that is considered to be immediately spent. However, it can have long-term consequences, as it stays on your police file for life – and will be likely to appear on any enhanced Disclosure and Barring Service (DBS) check carried out later.The credit reference agency Experian told us criminal fines and convictions have no impact on credit scores, and only a fraud conviction would show up as a “marker”. Banks generally take a similar stance. Nationwide says it does not ask about criminal convictions when someone is opening an account. Only serious financial crimes such as money laundering, bribery, tax evasion or mortgage fraud would lead to account withdrawal, it adds.However, things become a bit murkier when it comes to mortgage applications, says Stacey at Unlock. Mortgage companies do ask about unspent convictions, and every year, the charity hears reports of people having their mortgage application seemingly turned down for this reason.Stacey says most lenders will ask about criminal records – typically: “Have you ever been convicted, or have any prosecutions pending for any criminal offence (other than motoring offences)?” Under the Rehabilitation of Offenders Act 1974, spent convictions do not have to be disclosed as part of a mortgage application, irrespective of what questions are asked. Mortgage companies should be clear about this, but often aren’t, he says.If your conviction is unspent, you will need to disclose it.Ruby Dinsmore, an employment law specialist at Slater and Gordon, says: “Strictly speaking, employees are under no legal obligation to tell their boss if they have been arrested or charged with an offence, but there are exceptions. For example, if their contract of employment states that they must disclose such matters, or the conviction affects their ability to do the job, such as a taxi driver banned from driving, or if they work in certain regulated professions.”She says honesty is usually the best policy, as the consequences could be much worse if an employer were to find out at a later stage.“While information about arrests is not publicly available – unless an employer were to carry out an enhanced background check – details of charges and convictions are,” Dinsmore says.“And if the employer decided that their trust had been broken, that the person’s behaviour posed a threat to colleagues or customers or had brought the business into disrepute, they could be within their rights to dismiss them, even before the outcome of any criminal case.”For many younger protesters, this will be the biggest issue, particularly if they decide to change career.Most big employers conduct a basic DBS check before they offer a new employee a contract. This will show up only unspent convictions and conditional cautions, which will not be a problem for most first-time environmental protesters.However, if you decide you want to work with children or vulnerable adults, even on a voluntary basis, and the organisation does an enhanced check, it will show all convictions – including spent ones – plus cautions and any other information the police deem to be relevant. Most cautions given to first-time Extinction Rebellion protesters would likely only come off their enhanced check after six years.It would then be up to the employer to decide whether to carry on. Would a caution following a climate protest lead to a teacher being denied a job offer?It is worth noting that plenty of people taking jobs in finance have been caught out after telling their employer they had no convictions, as they were spent, only to have the offer withdrawn when the employer did a DBS check. Arguably, as more people are arrested at climate protests, employers will have to stop lumping them in with every other convicted or cautioned person.Generally, anyone travelling to the US for less than 90 days can travel under the visa waiver programme. However, if you have been arrested, you are ineligible to travel under the scheme, and will have to apply to the US embassy for a visa. A typical six-month conditional discharge given to a climate protester would probably not be grounds for a visa refusal, but the visa process can be a real pain. Equally, those planning to emigrate in later life will have to disclose any brushes with the law, and it could be a problem depending on the country.Miranda Cox, who was one of a number of people arrested after locking themselves to the entrance to Cuadrilla’s fracking site near Blackpool, says environmental protesters need to go into the process with their eyes open.Along with 11 others, she pleaded not guilty in 2017 to obstructing the highway, but was convicted. They each received a 12-month conditional discharge and had to pay a total of £270 in costs.“Looking back on it, I think we were a little naive about the consequences. We knew we wouldn’t be visiting America any time soon but we didn’t really think about the other consequences. I think we were lucky that most of us were a bit older and we weren’t about to make big career changes or similar,” says Cox, 50, who was a councillor at the time.She says she did not have insurance problems but others in the group have faced rises in car premiums. No one lost their job, she says, but she suspects that was more due to their circumstances.“To anyone thinking of joining an environmental protest I’d say go for it, as you will be on the right side of history. However, you need to go into it with your eyes open. Being handcuffed and thrown in the back of a police van and spending several hours in a police cell was really unpleasant – much worse than I thought it would be,” she says."
Mortgages: 40-year terms are becoming the norm – but watch out,First-time buyers could end up paying a lot more – and not be mortgage-free until their 70s,Rupert Jones,2019-10-19T07:00:25+0100,"Mortgages with a maximum term of 40 years are now becoming the norm, according to new data this week. However, with the average age of a first-time buyer standing at 32, that raises the prospect of a generation of homeowners not achieving mortgage-free status until they are in their 70s.Latest research from the data experts at Moneyfacts.co.uk shows that 57% of the residential mortgage products currently available have a standard maximum term of up to 40 years – up from just under 36% in March 2014.It provides more evidence that the traditional 25-year mortgage is increasingly becoming a thing of the past, particularly when it comes to first-timers.Yorkshire building society this month became the latest big provider to increase its maximum term to 40 years.By stretching the term, borrowers can reduce their monthly payments and are therefore more likely to meet banks’ strict affordability rules.But there’s a big sting in the tail. Moneyfacts gives the example of a £250,000 repayment home loan with an interest rate of 2.5%.Over 25 years, that equates to a monthly repayment of £1,121, and the total interest payable would be £86,463.The same mortgage taken over 40 years would cut the monthly repayments to £824, but whack up the total interest to £145,733. That’s an additional £59,270.Shaun Church, a director at mortgage broker Private Finance, says: “Continued efforts need to be made to ensure home ownership remains attainable early in adulthood to avoid jeopardising this generation’s financial security later in life.”Darren Cook at Moneyfacts says an extended mortgage term may well go beyond pension age, “so it is imperative these borrowers consider their options and attempt to make provisions if their personal circumstances change”."
