,content,headline,time,cleaned_content,topic,probability
7379,"Even by Donald Trump’s standards his Twitter rant attacking China on Friday was extraordinary. In a series of outbursts Trump “hereby ordered” US companies to stop doing business with China, accused the country of killing 100,000 Americans a year with imported fentanyl and stealing hundred of billions in intellectual property.The attack marked a new low in Sino-US relations and looks certain to escalate a trade war already worrying investors, manufacturers and economists who are concerned that the dispute between the two economic superpowers could trigger a recession.Not so long ago Trump called China’s president, Xi Jinping, “a good friend”. Now he is an “enemy”. How did we get here?On the campaign trail Trump railed against China accusing it of pulling off “one of the greatest thefts in the history of the world” and “raping” the US economy.Trump repeated the word China so often it spawned a viral video of him saying it over and over again. The attacks were a hit with voters and helped get him elected. He has continued lambasting China – to cheers – at rallies ever since.His main beef? The trade deficit.The US imported a record $539.5bn in goods from China in 2018 and sold the Chinese $120.3bn in return. The difference between those two numbers – $419.2bn – is the trade deficit.That deficit has been growing for years as manufacturing has shifted to low-cost China and, according to Trump, it explains the hollowing out of US manufacturing.For Trump, and especially for his adviser Peter Navarro, who once described China as “the planet’s most efficient assassin”, trade deficits represent an existential threat to US jobs and national security. China makes up the largest part of the US trade deficit but those fears are also behind his disputes with the EU, Canada and Mexico.His detractors argue these deficit worries are hyperbole and a result of the US’s stronger economy, which allows consumers to buy goods at cheaper prices.The truth is probably somewhere in between.While it’s true that unemployment is at record lows and consumers continue to prop up the economy, manufacturing jobs have been lost (automation is also to blame for this) and with them wage growth (although the hollowing out of unions plays a part here).But it is not just deficits that concerns Trump.China has a deserved reputation for intellectual property theft. On Friday, Trump estimated China robs the US of “hundreds of billions” a year in ideas.In March, a CNBC poll found one in five US corporations had intellectual property stolen from them within the last year by China.According to the Commission on the Theft of American Intellectual Property, the theft costs $600bn a year.Like Tesla, Nio, a Chinese electric vehicle (EV) company, is suffering as subsidies for EVs are phased out. Unlike Tesla, Nio has Xi. China is pumping $1.5bn into the company to keep it on the road, the latest in a series of handouts that the Trump administration believes are unfair.Cheap steel and aluminium, subsidized by the Chinese government, are the origins of this trade dispute. According to the White House, last year alone China dumped and unfairly subsidized goods including steel wheels, tool chests and cabinets and rubber bands on to the US market.To be fair the US too is more than willing to bail out its industries (see: the banks or the automakers) at the taxpayers’ expense. But at this point “fair” is not up for discussion.Earlier this month the US officially accused China of manipulating its currency “to gain unfair competitive advantage in international trade”.It was the first time since 1994 that such a complaint has been made official and comes as the dollar has strengthened against world currencies. The dispute adds another layer of tension to a complex situation.China disputed the charge accusing the US of “deliberately destroying international order” with “unilateralism and protectionism”.The International Monetary Fund (IMF) appears to be on China’s side, arguing the devaluation of the yuan is largely in line with worsening economic conditions in China.The US has now slapped billions of dollars on tariffs on Chinese goods. China retaliated, again, on Friday with more levies on US goods. China’s economic growth has slowed to levels unseen since 1992; US economic forecasts have also been cut. American farmers were the first to feel the result, as China has canceled orders, and manufacturers are increasingly gloomy. So far US consumers have not felt the pinch but JP Morgan estimates the average US household will end up paying an extra $1,000 a year for goods if the latest set of tariffs go through.The unanswerable question is whether any of this will sway Trump. If his supporters continue to see a trade war with China – and the pain it will cause – as the necessary price to Make America Great Again, then the answer is probably no.",Here are the reasons for Trump's economic war with China,2019-08-23/21:10:16,even by donald trump s standards his twitter rant attacking china on friday was extraordinary in a series of outbursts trump hereby ordered us companies to stop doing business with china accused the country of killing   americans a year with imported fentanyl and stealing hundred of billions in intellectual property the attack marked a new low in sino us relations and looks certain to escalate a trade war already worrying investors manufacturers and economists who are concerned that the dispute between the two economic superpowers could trigger a recession not so long ago trump called china s president xi jinping a good friend now he is an enemy how did we get here on the campaign trail trump railed against china accusing it of pulling off one of the greatest thefts in the history of the world and raping the us economy trump repeated the word china so often it spawned a viral video of him saying it over and over again the attacks were a hit with voters and helped get him elected he has continued lambasting china to cheers at rallies ever since his main beef the trade deficit the us imported a record  bn in goods from china in  and sold the chinese  bn in return the difference between those two numbers  bn is the trade deficit that deficit has been growing for years as manufacturing has shifted to low cost china and according to trump it explains the hollowing out of us manufacturing for trump and especially for his adviser peter navarro who once described china as the planet s most efficient assassin trade deficits represent an existential threat to us jobs and national security china makes up the largest part of the us trade deficit but those fears are also behind his disputes with the eu canada and mexico his detractors argue these deficit worries are hyperbole and a result of the us s stronger economy which allows consumers to buy goods at cheaper prices the truth is probably somewhere in between while it s true that unemployment is at record lows and consumers continue to prop up the economy manufacturing jobs have been lost automation is also to blame for this and with them wage growth although the hollowing out of unions plays a part here but it is not just deficits that concerns trump china has a deserved reputation for intellectual property theft on friday trump estimated china robs the us of hundreds of billions a year in ideas in march a cnbc poll found one in five us corporations had intellectual property stolen from them within the last year by china according to the commission on the theft of american intellectual property the theft costs bn a year like tesla nio a chinese electric vehicle ev company is suffering as subsidies for evs are phased out unlike tesla nio has xi china is pumping  bn into the company to keep it on the road the latest in a series of handouts that the trump administration believes are unfair cheap steel and aluminium subsidized by the chinese government are the origins of this trade dispute according to the white house last year alone china dumped and unfairly subsidized goods including steel wheels tool chests and cabinets and rubber bands on to the us market to be fair the us too is more than willing to bail out its industries see the banks or the automakers at the taxpayers expense but at this point fair is not up for discussion earlier this month the us officially accused china of manipulating its currency to gain unfair competitive advantage in international trade it was the first time since  that such a complaint has been made official and comes as the dollar has strengthened against world currencies the dispute adds another layer of tension to a complex situation china disputed the charge accusing the us of deliberately destroying international order with unilateralism and protectionism the international monetary fund imf appears to be on china s side arguing the devaluation of the yuan is largely in line with worsening economic conditions in china the us has now slapped billions of dollars on tariffs on chinese goods china retaliated again on friday with more levies on us goods china s economic growth has slowed to levels unseen since  us economic forecasts have also been cut american farmers were the first to feel the result as china has canceled orders and manufacturers are increasingly gloomy so far us consumers have not felt the pinch but jp morgan estimates the average us household will end up paying an extra   a year for goods if the latest set of tariffs go through the unanswerable question is whether any of this will sway trump if his supporters continue to see a trade war with china and the pain it will cause as the necessary price to make america great again then the answer is probably no ,US China Trade War,0.217096999
8084,"Global stocks fell sharply on Friday after Donald Trump threatened to impose tariffs on $300bn (£247.6bn) of Chinese goods in a rapid escalation of the trade war between the world’s two biggest economies. Trump is applying pressure to try to force China to narrow the trade deficit – the gap between imports and exports – between the two countries. He complains that China buys fewer US goods than the US buys from China, a gap worth $419.5bn last year. He has also accused Chinese firms of stealing US companies’ intellectual property and called for Beijing to alter its rules.Tariffs are border taxes imposed by one country or economic bloc on goods shipped from a trading partner. The idea is to drive up the cost of those goods to make them less attractive to consumers than domestic produce. The taxes are paid by buyers of goods when they cross the border into the country imposing the tariff.Trump is threatening tariffs of 10% on $300bn of Chinese imports. The White House already levies tariffs of 25% on $250bn of Chinese goods. Adding both together would mean roughly all Chinese imports to the US face higher taxes. China sold $539.7bn of goods to the US last year.Beijing has retaliated with tariffs of up to 25% on US goods worth $113bn. China is constrained by how much further it can go, given that total imports from the US were worth $120.1bn last year. However, the trade war has extended beyond tariffs before, with rules to make life difficult for US or Chinese companies, such as the US blacklisting the Chinese technology company Huawei.The International Monetary Fund has said the US-China trade war is dragging on global growth. Last month it said the conflict would cut growth by 0.1 percentage points in 2019 and 2020 from its April forecasts, at 3.2% and 3.5% respectively. International trade growth has stalled and business investment has been paused because of the uncertainty over trade. Factory output has stalled in several countries including the UK, Germany and Italy, with a knock-on impact on growth. Central banks including the US Federal Reserve and European Central Bank are under pressure to cut interest rates as a consequence.The escalation from Trump was a surprise and China has said it will not be intimidated – a sign that the conflict will not dissipate quickly. Economists believe tariffs could just be a negotiating tactic and the US president has flip-flopped before, raising hopes of a resolution. Trump could also expand his trade war to involve other nations, as well as the EU. He has tariffs on car imports in his sights, ostensibly to protect the US auto industry. Economists say imposing car tariffs on the EU would dramatically escalate the global trade war and further damage global growth.",Why is Trump imposing tariffs on China and how could it affect global economy?,2019-08-02/13:06:14,global stocks fell sharply on friday after donald trump threatened to impose tariffs on bn  bn of chinese goods in a rapid escalation of the trade war between the world s two biggest economies trump is applying pressure to try to force china to narrow the trade deficit the gap between imports and exports between the two countries he complains that china buys fewer us goods than the us buys from china a gap worth  bn last year he has also accused chinese firms of stealing us companies intellectual property and called for beijing to alter its rules tariffs are border taxes imposed by one country or economic bloc on goods shipped from a trading partner the idea is to drive up the cost of those goods to make them less attractive to consumers than domestic produce the taxes are paid by buyers of goods when they cross the border into the country imposing the tariff trump is threatening tariffs of  on bn of chinese imports the white house already levies tariffs of  on bn of chinese goods adding both together would mean roughly all chinese imports to the us face higher taxes china sold  bn of goods to the us last year beijing has retaliated with tariffs of up to  on us goods worth bn china is constrained by how much further it can go given that total imports from the us were worth  bn last year however the trade war has extended beyond tariffs before with rules to make life difficult for us or chinese companies such as the us blacklisting the chinese technology company huawei the international monetary fund has said the us china trade war is dragging on global growth last month it said the conflict would cut growth by   percentage points in  and  from its april forecasts at   and   respectively international trade growth has stalled and business investment has been paused because of the uncertainty over trade factory output has stalled in several countries including the uk germany and italy with a knock on impact on growth central banks including the us federal reserve and european central bank are under pressure to cut interest rates as a consequence the escalation from trump was a surprise and china has said it will not be intimidated a sign that the conflict will not dissipate quickly economists believe tariffs could just be a negotiating tactic and the us president has flip flopped before raising hopes of a resolution trump could also expand his trade war to involve other nations as well as the eu he has tariffs on car imports in his sights ostensibly to protect the us auto industry economists say imposing car tariffs on the eu would dramatically escalate the global trade war and further damage global growth ,US China Trade War,0.303900987
9182,"Donald Trump has threatened fresh tariffs on $4bn (£3.2bn) of European products including cheese, scotch whisky and olives, ratcheting up pressure on the EU in a long-running row over aircraft subsidies.The US trade representative’s office released a list of 89 additional items – including olives, Italian and Dutch cheese, Scotch whisky, Irish whiskey, pasta, coffee and ham – that could face tariffs. These join products worth $21bn that were announced as potential targets for tariffs in April, which included roquefort cheese, wine, champagne, olive oil and seafood such as oysters. The latest list also includes a number of copper products and other metals.The move came days after a truce was reached in the trade war between the US and China.The US and the EU have both threatened to impose tariffs on planes, tractors and food in a tit-for-tat trade row that was sparked by aircraft subsidies given to US aircraft maker Boeing and its European rival, Airbus.Trump imposed a 25% tariff on European steel and 10% on aluminium imports that came into effect in May 2018, as he claimed  “trade wars are good”. The EU responded in February by imposing limits on steel imports.Tariffs are border taxes charged on foreign imports. Importers pay them upon entry to the customs agency of the country or bloc imposing them.Tariffs can be levied in different ways. It can be a flat-rate tariff linked to weight, or calculated as a proportion of the overall value of the goods. It can also be a mixture of both. A country can set a quota, enabling a certain volume of a product to flow in before a higher tariff rate kicks in.Tariffs raise money for governments, but are primarily used to raise the price of foreign goods, protecting domestic producers from global competition.Countries signed up to the World Trade Organization (WTO) must impose tariffs at the same level for all other WTO-member trading partners under the organisation’s “most favoured nation” rule – unless they secure alternative deals with particular countries or trading blocs.Richard PartingtonThe World Trade Organization has found that Boeing and Airbus, the world’s two largest aircraft makers, received billions of dollars of subsidies, in the world’s largest-ever corporate trade dispute. The WTO is expected to rule on the US sanctions request over the summer, although this could be postponed to September.However, during the Paris Air Show in mid-June, Reuters reported that the US could be open to negotiations on an “enforceable mechanism” that would allow Airbus to receive government funding on commercial terms. As part of the deal, the US would make tax incentives provided to Boeing compliant with trade rulings.",Donald Trump threatens new tariffs on $4bn of EU products,2019-07-02/10:23:26,donald trump has threatened fresh tariffs on bn  bn of european products including cheese scotch whisky and olives ratcheting up pressure on the eu in a long running row over aircraft subsidies the us trade representative s office released a list of  additional items including olives italian and dutch cheese scotch whisky irish whiskey pasta coffee and ham that could face tariffs these join products worth bn that were announced as potential targets for tariffs in april which included roquefort cheese wine champagne olive oil and seafood such as oysters the latest list also includes a number of copper products and other metals the move came days after a truce was reached in the trade war between the us and china the us and the eu have both threatened to impose tariffs on planes tractors and food in a tit for tat trade row that was sparked by aircraft subsidies given to us aircraft maker boeing and its european rival airbus trump imposed a  tariff on european steel and  on aluminium imports that came into effect in may  as he claimed trade wars are good the eu responded in february by imposing limits on steel imports tariffs are border taxes charged on foreign imports importers pay them upon entry to the customs agency of the country or bloc imposing them tariffs can be levied in different ways it can be a flat rate tariff linked to weight or calculated as a proportion of the overall value of the goods it can also be a mixture of both a country can set a quota enabling a certain volume of a product to flow in before a higher tariff rate kicks in tariffs raise money for governments but are primarily used to raise the price of foreign goods protecting domestic producers from global competition countries signed up to the world trade organization wto must impose tariffs at the same level for all other wto member trading partners under the organisation s most favoured nation rule unless they secure alternative deals with particular countries or trading blocs richard partingtonthe world trade organization has found that boeing and airbus the world s two largest aircraft makers received billions of dollars of subsidies in the world s largest ever corporate trade dispute the wto is expected to rule on the us sanctions request over the summer although this could be postponed to september however during the paris air show in mid june  reported that the us could be open to negotiations on an enforceable mechanism that would allow airbus to receive government funding on commercial terms as part of the deal the us would make tax incentives provided to boeing compliant with trade rulings ,US China Trade War,0.207105011
