,content,headline,time,cleaned_content,topic,probability
557,"Donald Trump will meet China’s negotiating team at the White House on Friday for the latest round of talks aimed at ending a 15-month trade battle that is weighing on the global economy.“Big day of negotiations with China. They want to make a deal, but do I?” the president tweeted. On Wall Street stocks moved higher on hopes that there would be a breakthrough in the dispute.Big day of negotiations with China. They want to make a deal, but do I? I meet with the Vice Premier tomorrow at The White House.China’s vice-premier, Liu He, is leading the delegation in negotiations with the US trade representative, Robert Lighthizer, and the treasury secretary, Steven Mnuchin.This is the 13th round of talks between the two sides and the world’s two biggest economies are deadlocked over US allegations that China steals technology and pressures foreign companies to hand over trade secrets as part of a sharp-elbowed drive to become a world leader in advanced industries such as robotics and self-driving cars.Ahead of the meeting a Chinese official told Bloomberg that China was open to a “partial trade deal” but talks have been further complicated by the US decision to blacklist 28 Chinese tech firms over Beijing’s treatment of Uighur Muslims and other predominantly Muslim ethnic minorities. That decision came just days before the latest talks were due to start.US-China relations have been further strained by a tweet from Daryl Morey, the general manager of the Houston Rockets basketball team, in support of the Hong Kong democracy movement. The tweet, since deleted, led to the cancellation of NBA events in China this week.Under Trump, the US has slapped tariffs on more than $360bn worth of Chinese imports and is planning to hit another $160bn 15 December. That would extend import taxes to virtually everything China ships to the United States. China has hit back by targeting about $120bn in US goods, focusing on farm products.The high cost of the tariffs and uncertainty over when and how the trade war will end have taken an economic toll, especially on manufacturing companies. A private survey last week found that US factory output had dropped to its lowest level since 2009, when the economy was in the grips of a deep recession.“Both sides have been losing, and so has the global economy,” said Myron Brilliant, head of international affairs at the US Chamber of Commerce.Brilliant, who spoke with both delegations before the meetings, sounded optimistic about the chances of progress, noting that Beijing has stepped up purchases of US soybeans in a goodwill gesture. He said he hoped a productive meeting would persuade the Trump administration to call off or postpone plans next Tuesday to hike tariffs on $250bn of Chinese imports from 25% to 30%.“We all know we can’t afford a further escalation of the trade war,” Brilliant said.Still, Beijing has been reluctant to make the kind of substantive policy reforms that would satisfy Washington. Doing so would probably require scaling back the Chinese leaders’ aspirations to technological dominance they see as crucial to their country’s future prosperity.The news came amid the chaos of the impeachment inquiry engulfing US politics, which is examining Trump’s phone call in July where he asked the president of Ukraine, Volodymyr Zelenskiy, to investigate Joe Biden, a leading Democratic rival in the 2020 US presidential election.Trump also last week brazenly asked China in public to investigate Biden and his son Hunter Biden over their international business dealings, despite no evidence of illicit activity and despite conspiracy theories about the Bidens and Ukraine having been debunked.",Trump to meet with China for talks aimed at ending trade war,2019-10-10/17:37:18,donald trump will meet china s negotiating team at the white house on friday for the latest round of talks aimed at ending a  month trade battle that is weighing on the global economy big day of negotiations with china they want to make a deal but do i the president tweeted on wall street stocks moved higher on hopes that there would be a breakthrough in the dispute big day of negotiations with china they want to make a deal but do i i meet with the vice premier tomorrow at the white house china s vice premier liu he is leading the delegation in negotiations with the us trade representative robert lighthizer and the treasury secretary steven mnuchin this is the th round of talks between the two sides and the world s two biggest economies are deadlocked over us allegations that china steals technology and pressures foreign companies to hand over trade secrets as part of a sharp elbowed drive to become a world leader in advanced industries such as robotics and self driving cars ahead of the meeting a chinese official told bloomberg that china was open to a partial trade deal but talks have been further complicated by the us decision to blacklist  chinese tech firms over beijing s treatment of uighur muslims and other predominantly muslim ethnic minorities that decision came just days before the latest talks were due to start us china relations have been further strained by a tweet from daryl morey the general manager of the houston rockets basketball team in support of the hong kong democracy movement the tweet since deleted led to the cancellation of nba events in china this week under trump the us has slapped tariffs on more than bn worth of chinese imports and is planning to hit another bn  december that would extend import taxes to virtually everything china ships to the united states china has hit back by targeting about bn in us goods focusing on farm products the high cost of the tariffs and uncertainty over when and how the trade war will end have taken an economic toll especially on manufacturing companies a private survey last week found that us factory output had dropped to its lowest level since  when the economy was in the grips of a deep recession both sides have been losing and so has the global economy said myron brilliant head of international affairs at the us chamber of commerce brilliant who spoke with both delegations before the meetings sounded optimistic about the chances of progress noting that beijing has stepped up purchases of us soybeans in a goodwill gesture he said he hoped a productive meeting would persuade the trump administration to call off or postpone plans next tuesday to hike tariffs on bn of chinese imports from  to  we all know we can t afford a further escalation of the trade war brilliant said still beijing has been reluctant to make the kind of substantive policy reforms that would satisfy washington doing so would probably require scaling back the chinese leaders aspirations to technological dominance they see as crucial to their country s future prosperity the news came amid the chaos of the impeachment inquiry engulfing us politics which is examining trump s phone call in july where he asked the president of ukraine volodymyr zelenskiy to investigate joe biden a leading democratic rival in the  us presidential election trump also last week brazenly asked china in public to investigate biden and his son hunter biden over their international business dealings despite no evidence of illicit activity and despite conspiracy theories about the bidens and ukraine having been debunked ,US China Trade War,0.223221138
1530,"Donald Trump continued to defend his trade war with China on Tuesday, claiming “great patriot farmers” in the US would benefit from tariff increases that triggered sell-offs in stock markets across the world.In a series of tweets, Trump promised a new deal with China would be reached soon and made a case for how farmers would benefit from a tariff increase that many of them oppose.If China stops buying American farm products because of tariffs, Trump said, farmers will be compensated. “This money will come from the massive tariffs being paid to the United States for allowing China, and others, to do business with us. The farmers have been ‘forgotten’ for many years. Their time is now!”The long-running trade dispute between the US and China escalated on Friday after Trump raised tariffs on $200bn of Chinese goods from 10% to 25%. China retaliated on Monday with tariffs on $60bn of US imports, precipitating a dive on the US stock markets.American farmers are likely to feel the pain first. Soybean exports to China collapsed last year when the trade war began, and agricultural exports will be hit harder when, or if, the new tariffs are imposed. Farmers are also suffering from extensive flooding that has delayed planting.“The sentiment out in farm country is getting grimmer by the day,” said John Heisdorffer, the chairman of the American Soybean Association. “Our patience is waning, our finances are suffering and the stress from months of living with the consequences of these tariffs is mounting.”The new round of tariffs will hit other parts of the US food industry, with beans, lentils, honey, flour, corn and oats all on the list of goods that will be taxed.Despite the mounting economic threat and escalating tensions, Trump was optimistic about reaching a deal with China.“When the time is right we will make a deal with China,” Trump tweeted. “It will all happen, and much faster than people think!”Trump’s position has divided Republicans, especially those in agricultural districts who fear the retaliatory tariffs will burden farmers, agricultural businesses and consumers.The president’s supporters claim short-term economic pain will have positive long-term consequences.The Republican senator Chuck Grassley, who represents Iowa, a state heavily reliant on agriculture, has called for a quick resolution to the dispute. “Americans understand the need to hold China accountable, but they also need to know that the administration understands the economic pain they would feel in a prolonged trade war,” Grassley said in a statement.• This article was amended on 15 May 2019. An earlier version said that Trump raised tariffs on $200m of Chinese goods from 10% to 25%. This has been corrected to $200bn.",Trump defends China tariffs and claims 'great patriot farmers' will reap benefits,2019-05-14/19:40:17,donald trump continued to defend his trade war with china on tuesday claiming great patriot farmers in the us would benefit from tariff increases that triggered sell offs in stock markets across the world in a series of tweets trump promised a new deal with china would be reached soon and made a case for how farmers would benefit from a tariff increase that many of them oppose if china stops buying american farm products because of tariffs trump said farmers will be compensated this money will come from the massive tariffs being paid to the united states for allowing china and others to do business with us the farmers have been forgotten for many years their time is now the long running trade dispute between the us and china escalated on friday after trump raised tariffs on bn of chinese goods from  to  china retaliated on monday with tariffs on bn of us imports precipitating a dive on the us stock markets american farmers are likely to feel the pain first soybean exports to china collapsed last year when the trade war began and agricultural exports will be hit harder when or if the new tariffs are imposed farmers are also suffering from extensive flooding that has delayed planting the sentiment out in farm country is getting grimmer by the day said john heisdorffer the chairman of the american soybean association our patience is waning our finances are suffering and the stress from months of living with the consequences of these tariffs is mounting the new round of tariffs will hit other parts of the us food industry with beans lentils honey flour corn and oats all on the list of goods that will be taxed despite the mounting economic threat and escalating tensions trump was optimistic about reaching a deal with china when the time is right we will make a deal with china trump tweeted it will all happen and much faster than people think trump s position has divided republicans especially those in agricultural districts who fear the retaliatory tariffs will burden farmers agricultural businesses and consumers the president s supporters claim short term economic pain will have positive long term consequences the republican senator chuck grassley who represents iowa a state heavily reliant on agriculture has called for a quick resolution to the dispute americans understand the need to hold china accountable but they also need to know that the administration understands the economic pain they would feel in a prolonged trade war grassley said in a statement this article was amended on  may  an earlier version said that trump raised tariffs on m of chinese goods from  to  this has been corrected to bn ,US China Trade War,0.225062922
1561,"World markets plunged further on Tuesday following heavy losses on Wall Street after China delivered a swift rebuff to Donald Trump by imposing retaliatory tariffs on $60bn of US imports.Beijing ignored warnings from Trump about the dangers of escalating the trade conflict and sent tremors through global markets by announcing a new 25% import duty on a range of US products.In early trade on Tuesday, Hong Kong led losses when the market reopened after a long weekend. The Hang Seng Index sank 1.7% while Shanghai shed 0.2% and Tokyo was off 0.7% at the break.Sydney and Singapore each dropped more than one percentage point, with Manila and Jakarta both down 1.6%. There were also losses in Taipei and Wellington, though Seoul edged up slightly.Medha Samant, director of investment at Fidelity International, told Bloomberg TV: “In the short term, it looks like volatility is here to stay and we could see this risk-off, risk-on going on for a long time.”The retreat came after the Nasdaq on Wall Street suffered its worst day of 2019 and the Dow ended at its lowest point in more than three months.In the latest stage of the tit-for-tat battle between the world’s two biggest economies, China targeted almost 2,500 products, from food and consumer goods to chemicals and machinery, and said the increases would come into force next month.Apple, Boeing and Caterpillar were the biggest casualties of a global market sell-off as investors concluded that they would be among the companies most affected by China’s action.The Dow Jones industrial average lost more than 600 points, both it and the S&P 500 recording their biggest losses since January, after hopes of a speedy resolution to the dispute were replaced by fears of a long and damaging trade war.In London, the blue-chip FTSE 100 fell 39 points, or 0.55%, to end Monday at 7,163, its lowest level since 13 March, while the FTSE 250 index of medium-sized, more UK-focused companies, fell more than 1.2% to a six-week low. The Europe-wide Stoxx 600 index also hit a two-month low, down 1.2%. Consumer goods-makers and technology firms led the fallers.Trump has drawn up plans to extend US tariffs to the $300bn-plus of Chinese imports not currently targeted, while there were hints from Beijing that it would start to sell some of the US Treasury bonds it holds.The US president took action last week after what the US considered backtracking by China’s president, Xi Jinping, on commitments contained in a 150-page draft trade deal between the two countries.But despite warnings from Trump of the risks of retaliation, China said it would “never surrender” to US pressure.US President Donald Trump Trump has often repeated that China pays for US tariffs on its goods. 'We have billions of dollars coming into our treasury from China. We never had 10 cents coming into our treasury; now we have billions coming in' he said on 24 January 2019. On 5 May he tweeted: 'For 10 months, China has been paying Tariffs to the USA.' But that is not how tariffs work.China's government and companies in China do not pay tariffs directly. Tariffs are a tax on imports. They are paid by US-registered firms to US customs for the goods they import into the United States. Importers often pass the costs of tariffs on to customers - manufacturers and consumers in the United States - by raising their prices.Chinese suppliers do shoulder some of the cost of US tariffs in indirect ways. Exporters sometimes, for instance, are forced to offer US importers a discount to help defray the costs of higher US duties. Chinese companies might also lose business if US importers find another tariff-free source of the same goods outside China. White House economic adviser Larry Kudlow has acknowledged that 'both sides will suffer on this' contradicting the president. In a series of tweets, Trump said: “I say openly to President Xi & all of my many friends in China that China will be hurt very badly if you don’t make a deal because companies will be forced to leave China for other countries. Too expensive to buy in China. You had a great deal, almost completed, & you backed out!”He added: “There will be nobody left in China to do business with. Very bad for China, very good for USA! But China has taken so advantage of the US for so many years, that they are way ahead (Our Presidents did not do the job). Therefore, China should not retaliate-will only get worse!”China criticised the White House for its “escalation of Sino-US economic and trade frictions, contrary to the consensus between China and the United States on resolving trade differences through consultations, jeopardising the interests of both sides and not meeting the general expectations of the international community.”Andrew Hunter of Capital Economics, said China’s move would risk provoking Trump. “That could make the prospect of US tariffs being imposed on the remaining $300bn of Chinese imports – provisional details of which were due to be published by the US trade representative later on Monday – even more likely.”China’s new 25% tariff will affect almost 2,500 items, from food and consumer goods to chemicals and machinery. Other products will soon incur a 20% or 10% additional levy.China’s Global Times newspaper reported that Beijing was also considering cutting orders for new Boeing planes and boycotting US agricultural products.Timme Spakman, economist at ING bank, said China’s response could have been harsher and showed that Beijing was keen to keep the door open for negotiations.Trump ordered the tariff increases after talks in Washington with China’s vice-premier Liu He ended with no deal in sight.The president suggested that manufacturers who make goods in China could shift production to other countries to avoid the tariffs. Trump said in another Twitter post that the trade war would not have a significant impact on US trade. “We are right where we want to be with China. Remember, they broke the deal with us and tried to renegotiate. We will be taking in tens of billions of dollars in tariffs from China. Buyers of product can make it themselves in the USA (ideal), or buy it from non-tariffed countries.”",Global markets fall as China hits back at US with new import tariffs,2019-05-14/04:47:17,world markets plunged further on tuesday following heavy losses on wall street after china delivered a swift rebuff to donald trump by imposing retaliatory tariffs on bn of us imports beijing ignored warnings from trump about the dangers of escalating the trade conflict and sent tremors through global markets by announcing a new  import duty on a range of us products in early trade on tuesday hong kong led losses when the market reopened after a long weekend the hang seng index sank   while shanghai shed   and tokyo was off   at the break sydney and singapore each dropped more than one percentage point with manila and jakarta both down   there were also losses in taipei and wellington though seoul edged up slightly medha samant director of investment at fidelity international told bloomberg tv in the short term it looks like volatility is here to stay and we could see this risk off risk on going on for a long time the retreat came after the nasdaq on wall street suffered its worst day of  and the dow ended at its lowest point in more than three months in the latest stage of the tit for tat battle between the world s two biggest economies china targeted almost   products from food and consumer goods to chemicals and machinery and said the increases would come into force next month apple boeing and caterpillar were the biggest casualties of a global market sell off as investors concluded that they would be among the companies most affected by china s action the dow jones industrial average lost more than  points both it and the s p  recording their biggest losses since january after hopes of a speedy resolution to the dispute were replaced by fears of a long and damaging trade war in london the blue chip ftse  fell  points or   to end monday at   its lowest level since  march while the ftse  index of medium sized more uk focused companies fell more than   to a six week low the europe wide stoxx  index also hit a two month low down   consumer goods makers and technology firms led the fallers trump has drawn up plans to extend us tariffs to the bn plus of chinese imports not currently targeted while there were hints from beijing that it would start to sell some of the us treasury bonds it holds the us president took action last week after what the us considered backtracking by china s president xi jinping on commitments contained in a  page draft trade deal between the two countries but despite warnings from trump of the risks of retaliation china said it would never surrender to us pressure us president donald trump trump has often repeated that china pays for us tariffs on its goods we have billions of dollars coming into our treasury from china we never had  cents coming into our treasury now we have billions coming in he said on  january  on  may he tweeted for  months china has been paying tariffs to the usa but that is not how tariffs work china s government and companies in china do not pay tariffs directly tariffs are a tax on imports they are paid by us registered firms to us customs for the goods they import into the united states importers often pass the costs of tariffs on to customers manufacturers and consumers in the united states by raising their prices chinese suppliers do shoulder some of the cost of us tariffs in indirect ways exporters sometimes for instance are forced to offer us importers a discount to help defray the costs of higher us duties chinese companies might also lose business if us importers find another tariff free source of the same goods outside china white house economic adviser larry kudlow has acknowledged that both sides will suffer on this contradicting the president in a series of tweets trump said i say openly to president xi all of my many friends in china that china will be hurt very badly if you don t make a deal because companies will be forced to leave china for other countries too expensive to buy in china you had a great deal almost completed you backed out he added there will be nobody left in china to do business with very bad for china very good for usa but china has taken so advantage of the us for so many years that they are way ahead our presidents did not do the job therefore china should not retaliate will only get worse china criticised the white house for its escalation of sino us economic and trade frictions contrary to the consensus between china and the united states on resolving trade differences through consultations jeopardising the interests of both sides and not meeting the general expectations of the international community andrew hunter of capital economics said china s move would risk provoking trump that could make the prospect of us tariffs being imposed on the remaining bn of chinese imports provisional details of which were due to be published by the us trade representative later on monday even more likely china s new  tariff will affect almost   items from food and consumer goods to chemicals and machinery other products will soon incur a  or  additional levy china s global times newspaper reported that beijing was also considering cutting orders for new boeing planes and boycotting us agricultural products timme spakman economist at ing bank said china s response could have been harsher and showed that beijing was keen to keep the door open for negotiations trump ordered the tariff increases after talks in washington with china s vice premier liu he ended with no deal in sight the president suggested that manufacturers who make goods in china could shift production to other countries to avoid the tariffs trump said in another twitter post that the trade war would not have a significant impact on us trade we are right where we want to be with china remember they broke the deal with us and tried to renegotiate we will be taking in tens of billions of dollars in tariffs from china buyers of product can make it themselves in the usa ideal or buy it from non tariffed countries ,US China Trade War,0.260002732
