,content,headline,time,cleaned_content,topic,probability
6000,"  - Wall Street surged on Tuesday and the S&P 500 approached a record high after Washington rekindled trade talks with Beijing, boosting sentiment along with growing investor confidence that the Fed will cut interest rates this year. U.S. President Donald Trump said he would meet with Chinese President Xi Jinping at the G20 summit later this month, and said talks between the two countries would restart after a recent lull. Global stock markets have rallied and retreated repeatedly in recent months in reaction to comments from Trump about progress - or lack of progress - in negotiating an end to the trade conflict. Trump’s statement on Tuesday pushed trade-sensitive industrials up 1.9% and technology stocks gained 1.7%. Together, they were the biggest boost to the benchmark index.  Chip companies, which have a sizable revenue exposure to China, led the rally in tech stocks, with the Philadelphia Semiconductor index surging 4.3%. “We can’t discount how big a deal it is for China and the U.S. not to go into a prolonged trade spat. I don’t think we’re out of the woods yet, though,” said King Lip, chief investment strategist at Baker Avenue Asset Management in San Francisco.  “I’d wait for the G20 meeting to see actual discussions coming out of that before we go back into a risk-on mode,” he said.  The U.S.-China trade war and its impact on economic growth have investors increasingly expecting the Federal Reserve will cut rates to preserve the U.S. economic expansion, which would be the longest on record this summer. The Fed is widely expected to leave interest rates unchanged at its two-day policy meeting that ends Wednesday, while laying the foundation for a cut later this year. The Fed is scheduled to release its statement at 2 p.m. (1800 GMT) on Wednesday and Chairman Jerome Powell will hold a press conference shortly after. The S&P 500 has gained 6% so far this month, and is only about 1% from the all-time high hit in early May.  The Dow Jones Industrial Average jumped 1.35% to end at  26,465.54 points, while the S&P 500 gained 0.97% to 2,917.75. The Nasdaq Composite surged 1.39% to 7,953.88. Comments by European Central Bank President Mario Draghi  indicating the possibility of fresh rate cuts or asset purchases also lifted sentiment. Apple Inc, Amazon.com Inc and Microsoft Corp rose between 0.8% and 2.4%, with the tech triumvirate contributing more than any other stocks to increases in the S&P 500 and Nasdaq. Boeing Co jumped 5.4%, buoying the Dow, after the planemaker received an order for its 737 MAX jets valued at more than $24 billion at list prices; the 737 MAX has been grounded since March after two deadly crashes.     The utilities, real estate and consumer staples sectors, all of which are viewed as defensive, were the only decliners. With about two weeks left in the second quarter, analysts on average expect second-quarter S&P 500 earnings per share to increase by 0.2%, according to IBES data from Refinitiv. In early April, that estimate stood at 2.8% growth. The S&P 500 posted 57 new 52-week highs and 1 new low; the Nasdaq Composite recorded 85 new highs and 46 new lows. Volume on U.S. exchanges was 7.0 billion shares, compared to the 6.8 billion average for the full session over the last 20 trading days. ",Wall Street nears record as mood on trade again turns optimistic,"June 18, 2019 /  1:04 PM ", wall street surged on tuesday and the s p  approached a record high after washington rekindled trade talks with beijing boosting sentiment along with growing investor confidence that the fed will cut interest rates this year u s president donald trump said he would meet with chinese president xi jinping at the g summit later this month and said talks between the two countries would restart after a recent lull global stock markets have rallied and retreated repeatedly in recent months in reaction to comments from trump about progress or lack of progress in negotiating an end to the trade conflict trump s statement on tuesday pushed trade sensitive industrials up   and technology stocks gained   together they were the biggest boost to the benchmark index chip companies which have a sizable revenue exposure to china led the rally in tech stocks with the philadelphia semiconductor index surging   we can t discount how big a deal it is for china and the u s not to go into a prolonged trade spat i don t think we re out of the woods yet though said king lip chief investment strategist at baker avenue asset management in san francisco i d wait for the g meeting to see actual discussions coming out of that before we go back into a risk on mode he said the u s china trade war and its impact on economic growth have investors increasingly expecting the federal reserve will cut rates to preserve the u s economic expansion which would be the longest on record this summer the fed is widely expected to leave interest rates unchanged at its two day policy meeting that ends wednesday while laying the foundation for a cut later this year the fed is scheduled to release its statement at  p m  gmt on wednesday and chairman jerome powell will hold a press conference shortly after the s p  has gained  so far this month and is only about  from the all time high hit in early may the dow jones industrial average jumped   to end at    points while the s p  gained   to    the nasdaq composite surged   to    comments by european central bank president mario draghi indicating the possibility of fresh rate cuts or asset purchases also lifted sentiment apple inc amazon com inc and microsoft corp rose between   and   with the tech triumvirate contributing more than any other stocks to increases in the s p  and nasdaq boeing co jumped   buoying the dow after the planemaker received an order for its  max jets valued at more than  billion at list prices the  max has been grounded since march after two deadly crashes the utilities real estate and consumer staples sectors all of which are viewed as defensive were the only decliners with about two weeks left in the second quarter analysts on average expect second quarter s p  earnings per share to increase by   according to ibes data from refinitiv in early april that estimate stood at   growth the s p  posted  new  week highs and  new low the nasdaq composite recorded  new highs and  new lows volume on u s exchanges was   billion shares compared to the   billion average for the full session over the last  trading days ,US China Trade War,0.186750382
6376,"WASHINGTON/BEIJING   - U.S. President Donald Trump said on Monday he was ready to impose another round of punitive tariffs on Chinese imports if he cannot make progress in trade talks with China’s President at a Group of 20 summit later this month. Since two days of talks to resolve the U.S.-China trade dispute last month in Washington ended in a stalemate, Trump has repeatedly said he expected to meet President Xi Jinping at the June 28-29 summit in Osaka, Japan. China has not confirmed any such meeting. Trump said last week he would decide after the meeting of the leaders of the world’s largest economies whether to carry out a threat to impose tariffs on at least $300 billion in Chinese goods.  In comments to reporters on Monday, Trump said he still thought the meeting with Xi would happen. “We are scheduled to talk and to meet. I think interesting things will happen. Let’s see what happens,” Trump told reporters at the White House. The United States has already imposed 25% tariffs on $250 billion worth of goods.  China’s foreign ministry said on Monday that China is open to more trade talks with Washington but has nothing to announce about a possible meeting. Tensions between Washington and Beijing rose sharply in May after the Trump administration accused China of having reneged on promises to make structural economic changes during months of trade talks. The United States is seeking sweeping changes, including an end to forced technology transfers and theft of U.S. trade secrets. It also wants curbs on subsidies for Chinese state-owned enterprises and better access for U.S. firms in Chinese markets. On May 10, Trump raised tariffs on $200 billion of Chinese goods up to 25% and took steps to levy duties on an additional $300 billion in Chinese imports. Beijing retaliated with tariff hikes on a revised list of $60 billion in U.S. goods. The U.S. government has also angered China by putting Huawei Technologies Co Ltd on a blacklist that effectively bans U.S. companies from doing business with the Chinese firm, the world’s biggest telecoms equipment maker. Investors worry China will retaliate by putting U.S. companies on a blacklist or banning exports to the United States of rare earth metals, which are used in products such as memory chips, rechargeable batteries and cell phones. Fitch Ratings said on Monday any such move would be disruptive to the U.S. technology sector and could hurt some Chinese sectors as well, though it added that it was too early to assess potential credit implications. In an interview with CNBC, Trump said the Huawei dispute could be addressed as part of a trade deal with China. The escalating trade war between the world’s two largest economies has unnerved financial markets with worries that it could further disrupt global manufacturing and supply chains and push an already slowing global economy into recession. On Sunday, International Monetary Fund Managing Director Christine Lagarde said resolving the current trade tensions should be the top priority for G20 economies. China reported on Monday its exports unexpectedly grew 1.1 percent in May from a year ago despite the higher U.S. tariffs, but imports fell the most in nearly three years. Some analysts suspect Chinese exporters may have rushed out shipments to the United States to avoid potential new U.S. tariffs. Many U.S. business groups oppose the tariffs, with companies worried about slowing demand as they pass higher prices along to consumers and manufacturers across a range of products. Late last month Trump said he would impose tariffs on Mexican goods if Mexico did not agree to take strong steps to curb the flow of mostly Central American migrants crossing the U.S.-Mexico border. Washington and Mexico City reached a deal on Friday to avert the tariffs, removing for the time being at least the prospect that the United States would find itself in trade wars with two of its three largest trading partners. Global equities rose on Monday and the U.S. dollar gained against a basket of currencies. The Mexican peso rose more than 2% against the greenback, reversing most of its losses from the past couple of weeks.  Trump, who has embraced protectionism as part of an “America First” agenda, said on Monday the tariff threat on Mexico would be reinstated if Mexico’s Congress did not ratify another part of the migration pact. ",Trump ready to slap more tariffs on China after G20 meeting,"June 10, 2019 /  1:05 PM ",washington beijing u s president donald trump said on monday he was ready to impose another round of punitive tariffs on chinese imports if he cannot make progress in trade talks with china s president at a group of  summit later this month since two days of talks to resolve the u s china trade dispute last month in washington ended in a stalemate trump has repeatedly said he expected to meet president xi jinping at the june   summit in osaka japan china has not confirmed any such meeting trump said last week he would decide after the meeting of the leaders of the world s largest economies whether to carry out a threat to impose tariffs on at least  billion in chinese goods in comments to reporters on monday trump said he still thought the meeting with xi would happen we are scheduled to talk and to meet i think interesting things will happen let s see what happens trump told reporters at the white house the united states has already imposed  tariffs on  billion worth of goods china s foreign ministry said on monday that china is open to more trade talks with washington but has nothing to announce about a possible meeting tensions between washington and beijing rose sharply in may after the trump administration accused china of having reneged on promises to make structural economic changes during months of trade talks the united states is seeking sweeping changes including an end to forced technology transfers and theft of u s trade secrets it also wants curbs on subsidies for chinese state owned enterprises and better access for u s firms in chinese markets on may  trump raised tariffs on  billion of chinese goods up to  and took steps to levy duties on an additional  billion in chinese imports beijing retaliated with tariff hikes on a revised list of  billion in u s goods the u s government has also angered china by putting huawei technologies co ltd on a blacklist that effectively bans u s companies from doing business with the chinese firm the world s biggest telecoms equipment maker investors worry china will retaliate by putting u s companies on a blacklist or banning exports to the united states of rare earth metals which are used in products such as memory chips rechargeable batteries and cell phones fitch ratings said on monday any such move would be disruptive to the u s technology sector and could hurt some chinese sectors as well though it added that it was too early to assess potential credit implications in an interview with cnbc trump said the huawei dispute could be addressed as part of a trade deal with china the escalating trade war between the world s two largest economies has unnerved financial markets with worries that it could further disrupt global manufacturing and supply chains and push an already slowing global economy into recession on sunday international monetary fund managing director christine lagarde said resolving the current trade tensions should be the top priority for g economies china reported on monday its exports unexpectedly grew   percent in may from a year ago despite the higher u s tariffs but imports fell the most in nearly three years some analysts suspect chinese exporters may have rushed out shipments to the united states to avoid potential new u s tariffs many u s business groups oppose the tariffs with companies worried about slowing demand as they pass higher prices along to consumers and manufacturers across a range of products late last month trump said he would impose tariffs on mexican goods if mexico did not agree to take strong steps to curb the flow of mostly central american migrants crossing the u s mexico border washington and mexico city reached a deal on friday to avert the tariffs removing for the time being at least the prospect that the united states would find itself in trade wars with two of its three largest trading partners global equities rose on monday and the u s dollar gained against a basket of currencies the mexican peso rose more than  against the greenback reversing most of its losses from the past couple of weeks trump who has embraced protectionism as part of an america first agenda said on monday the tariff threat on mexico would be reinstated if mexico s congress did not ratify another part of the migration pact ,US China Trade War,0.251858711
11238,"WASHINGTON   - President Donald Trump on Friday said he is confident the United States can forge a trade deal with China, but added that he thinks his country would do very well with or without an agreement with the world’s second-largest economy.  Asked if he was still confident he could get a deal with China: “Sure, I’m confident, but if we don’t make a very good deal for our country, I wouldn’t make a deal,” Trump said. Asked about a report that China was not positive about a trade deal and that a meeting with President Xi Jinping might not happen, Trump said “I haven’t heard that. I think we’re doing well ... We’ll do very well either way, with or without a deal.”   Speaking on Bloomberg TV, White House economic adviser Larry Kudlow said the two countries could meet soon to continue hammering out a deal. “It could go into April ... We made a lot of agreements here in Washington two weeks ago ... Now it has to go back and clear the top level of President Xi and the politburo in Beijing ... That’s the key – not the timing, not even the place – we have to get it right so it’s in America’s interest,” Kudlow said. China’s exports tumbled the most in three years in February while imports fell for a third straight month, pointing to a further slowdown in the economy and stirring talk of a “trade recession”, despite a spate of support measures. The increasingly weak China data comes amid months of intense negotiations between Washington and Beijing aimed at ending their trade dispute. On Wednesday, the U.S. reported its goods trade deficit with China surged to an all-time high last year, underlining one of the key sticking points. Chinese shares fell more than 4 percent on Friday after the data showed exports contracting, pushing global equities to three-week troughs. ",Trump 'confident' about getting a trade deal with China,"March 8, 2019 /  3:05 PM ",washington president donald trump on friday said he is confident the united states can forge a trade deal with china but added that he thinks his country would do very well with or without an agreement with the world s second largest economy asked if he was still confident he could get a deal with china sure i m confident but if we don t make a very good deal for our country i wouldn t make a deal trump said asked about a report that china was not positive about a trade deal and that a meeting with president xi jinping might not happen trump said i haven t heard that i think we re doing well we ll do very well either way with or without a deal speaking on bloomberg tv white house economic adviser larry kudlow said the two countries could meet soon to continue hammering out a deal it could go into april we made a lot of agreements here in washington two weeks ago now it has to go back and clear the top level of president xi and the politburo in beijing that s the key not the timing not even the place we have to get it right so it s in america s interest kudlow said china s exports tumbled the most in three years in february while imports fell for a third straight month pointing to a further slowdown in the economy and stirring talk of a trade recession despite a spate of support measures the increasingly weak china data comes amid months of intense negotiations between washington and beijing aimed at ending their trade dispute on wednesday the u s reported its goods trade deficit with china surged to an all time high last year underlining one of the key sticking points chinese shares fell more than  percent on friday after the data showed exports contracting pushing global equities to three week troughs ,US China Trade War,0.262879968
11348,"WASHINGTON   - U.S. President Donald Trump said on Wednesday that trade talks with China were moving along well and predicted either a “good deal” or no deal between the world’s two largest economies. Washington and Beijing have been locked in intense negotiations to end a months-long trade war. Trump, citing progress in talks, last week delayed a planned tariff increase to 25 percent from 10 percent on $200 billion of Chinese goods. “They’re moving along well and we’ll see what happens,” the president said on Wednesday during a meeting in the Oval Office, referring to the trade talks. He said there would either be “a good deal or it’s not going to be a deal, but I think they’re moving along very nicely.” Trump’s comments after the Commerce Department said on Wednesday that the U.S. goods trade deficit surged to a record high in 2018 as strong domestic demand fueled by lower taxes pulled in imports, despite the president’s tariffs and “America First” policies aimed at shrinking the trade gap. Talks are primarily taking place via video teleconference and going well, Ted McKinney, undersecretary for Trade and Foreign Agricultural Affairs, told a press call.   “Right now, I think there’s just a lot of work in getting words down ... a contract or agreement, and that’s the current status,” he added. The United States has demanded that China make substantial changes to its laws and practices to protect U.S. intellectual property, end forced transfers of U.S. technology to Chinese firms, curb generous industrial subsidies and open the domestic market to U.S. companies. In addition, Washington has sought increased Chinese purchases of U.S. goods, including farm and energy commodities and manufactured products, to reduce a U.S. trade deficit with China that it estimates at more than $417 billion for 2018. People familiar with the talks told Reuters the two sides still had substantial work ahead to reach agreement on a way to ensure China follows through on any pledges. Talks could still collapse if a deal cannot be reached on enforcement of these “structural” issues. ","Trump says China trade talks going well, predicts 'good deal' or no deal","March 6, 2019 /  7:34 PM ",washington u s president donald trump said on wednesday that trade talks with china were moving along well and predicted either a good deal or no deal between the world s two largest economies washington and beijing have been locked in intense negotiations to end a months long trade war trump citing progress in talks last week delayed a planned tariff increase to  percent from  percent on  billion of chinese goods they re moving along well and we ll see what happens the president said on wednesday during a meeting in the oval office referring to the trade talks he said there would either be a good deal or it s not going to be a deal but i think they re moving along very nicely trump s comments after the commerce department said on wednesday that the u s goods trade deficit surged to a record high in  as strong domestic demand fueled by lower taxes pulled in imports despite the president s tariffs and america first policies aimed at shrinking the trade gap talks are primarily taking place via video teleconference and going well ted mckinney undersecretary for trade and foreign agricultural affairs told a press call right now i think there s just a lot of work in getting words down a contract or agreement and that s the current status he added the united states has demanded that china make substantial changes to its laws and practices to protect u s intellectual property end forced transfers of u s technology to chinese firms curb generous industrial subsidies and open the domestic market to u s companies in addition washington has sought increased chinese purchases of u s goods including farm and energy commodities and manufactured products to reduce a u s trade deficit with china that it estimates at more than  billion for  people familiar with the talks told  the two sides still had substantial work ahead to reach agreement on a way to ensure china follows through on any pledges talks could still collapse if a deal cannot be reached on enforcement of these structural issues ,US China Trade War,0.191631302
12176,"WASHINGTON   - The United States is seeking to secure a pledge from China it will not devalue its yuan as part of an agreement intended to end the countries’ trade war, Bloomberg TV reported on Monday. According to Bloomberg, the United States wants to include in the memorandum of understanding paving the way to a final trade deal an agreement that the Chinese will not devalue their currency as a way to counteract U.S. tariffs on imports from China. ",U.S. seeking stable yuan pledge in China trade deal: Bloomberg TV,"February 19, 2019 /  5:47 PM ",washington the united states is seeking to secure a pledge from china it will not devalue its yuan as part of an agreement intended to end the countries trade war bloomberg tv reported on monday according to bloomberg the united states wants to include in the memorandum of understanding paving the way to a final trade deal an agreement that the chinese will not devalue their currency as a way to counteract u s tariffs on imports from china ,US China Trade War,0.203068376
